PS No & Name,Address,Constituency Number
1 - Bhatepuri,Z. P. Pra. Shala Bhatepuri,100
2 - Bhatepuri,Z. P. Pra. Shala Bhatepuri,100
3 - Bhatepuri,Z. P. Pra. Shala Bhatepuri,100
4 - Khanepuri,Z. P. Pra. Shala Khanepuri,100
5 - Wanadgaon,Z. P. Pra. Shala Vanadaganv,100
6 - Kachrewadi,Z. P. Pra. Shala Kacharevadi,100
7 - Pachanwadgaon,Z. P. Pra. Shala Pachanavadaganv East Side,100
8 - Pachanwadgaon,Z. P. Pra. Shala Pachanavadaganv West Side,100
9 - Bethlam,Douglas Girls Primary School at Bethlam,100
10 - Revgaon,Z. P. Pra. Shala Revaganv,100
11 - Revgaon,Z. P. Pra. Shala Revaganv,100
12 - Revgaon,Z. P. Pra. Shala Revaganv,100
13 - Pokalwadgaon,Z. P. Pra. Shala Pok Lavadaganv,100
14 - Thergaon,Z. P. Pra. Shala Thergaon,100
15 - Bapkal,Anganwadi Office Bapkal,100
16 - Utwad,Z. P. Pra. Shala Utavad,100
17 - Utwad,Z. P. Pra. Shala Utavad,100
18 - Pimpri Dukri,Z. P. Pra. Shala Pimparidukari Kholi Kr. 1,100
19 - Pimpri Dukri,Z. P. Pra. Shala Pimparidukari Kholi Kr. 2,100
20 - Ghodegaon,Z. P. Pra. Shala Ghodeganv,100
21 - Khodepuri,Z. P. Pra. Shala Khodepuri,100
22 - Nipani Pokhari,Z. P. Pra. Shala Nipani Pokhari,100
23 - Nasadgaon,Z. P. Pra. Shala Nasadaganv,100
24 - Takarwan,Z. P. Pra. Shala Takaravan,100
25 - Hiwardi,Z. P. Pra. Shala Hivardi,100
26 - Hiwardi,Z. P. Pra. Shala Hivardi,100
27 - Hastepimpalgaon,Z. P. Pra. Shala Hastepimpalaganv,100
28 - Shevga,Z. P. Pra. Shala Shevaga,100
29 - Pokhari Shingadi,Zilha Parishad Primary School New Building Pokhari Shingadi,100
30 - Dambri,Z. P. Pra. Shala Dambari,100
31 - Chitli Putli,Z. P. Pra. Shala Chitaliputali,100
32 - Chitli Putli,Z. P. Pra. Shala Chitaliputali,100
33 - Viregaon,Z. P. Pra. Shala Vireganv,100
34 - Viregaon,Z. P. Pra. Shala Vireganv,100
35 - Dhanora,Z. P. Pra. Shala Dhanora,100
36 - Dhanora,Z. P. Pra. Shala Dhanora,100
37 - Solgavhan,Z. P. Pra. Shala Solagavhan,100
38 - Hiwra Roshangaon,Z. P. Pra. Shala Hivararoshanaganv,100
39 - Hiwra Roshangaon,Z. P. Pra. Shala Hivararoshanaganv,100
40 - Hatwan,Z. P. Pra. Shala Hatavan,100
41 - Hatwan,Talathi Office Hatwan,100
42 - Wadiwadi,Z. P. Pra. Shala Vadivadi,100
43 - Wadiwadi,Z. P. Pra. Shala Vadivadi,100
44 - Hiswan Bu,Z. P. Pra. Shala Hisvan Bu.,100
45 - Hiswan Khurd,Z. P. Pra. Shala Hisvan Khu.,100
46 - Punegaon,Z. P. Pra. Shala Puneganv,100
47 - Islamwadi,Z. P. Prashala Islamavadi,100
48 - Dudhna Kalegaon,Z. P. Pra. Shala Dudhana Kaleganv East Side,100
49 - Dudhna Kalegaon,Z. P. Pra. Shala Dudhana Kaleganv East Side,100
50 - Daithana Bu,Z. P. Pra. Shala Daithana Bu.,100
51 - Mudhegaon,Z. P. Pra. Shala Mudheganv,100
52 - Gadhesavargaon,Z. P. Pra. Shala Gadhesavaraganv,100
53 - Malipimpalgaon,Z. P. Pra. Shala Malipimpalaganv,100
54 - Karla,Z. P. Pra. Shala Karala West Side,100
55 - Karla,Z. P. Pra. Shala Karala West Side,100
56 - Karla,Z. P. Pra. Shala Karala East Side,100
57 - Mamdabad,Z. P. Pra. Shala Mamadabad,100
58 - Mamdabad,Z. P. Pra. Shala Mamadabad,100
59 - Wazar,Z. P. Pra. Shala Vazar,100
60 - Wazar,Z. P. Pra. Shala Vazar,100
61 - Ranjaniwadi,Z. P. Pra. Shala Ranjanivadi,100
62 - Kavtha,Z. P. Pra. Shala Kavatha,100
63 - Ghetuli,Z. P. Pra. Shala Ghetoli,100
64 - Ranjani,Z. P. K. Pra. Shala Ranjani East Side,100
65 - Ranjani,Zilla Parishad Urdu Primary School Ranjani Room no. 2,100
66 - Ranjani,Zilla Parishad Central Primary School Ranjani Room no. 5,100
67 - Ranjani,Z. P. K. Pra. Shala Ranjani Dakshin Side,100
68 - Ranjani,Z. P. Pra. Shala Ranjani West Side,100
69 - Ranjani,Z. P. Pra. Shala Ranjani West Side,100
70 - Chitrawadgaon,Z. P. Pra. Shala Chitravadagaav,100
71 - Kardagaon,Z. P. Pra. Shala Karadaganv,100
72 - Kardagaon Wadi,Z. P. Pra. Shala Karadaganvavadi,100
73 - Bhutegaon,Z. P. Pra. Shala Bhuteganv,100
74 - Antarwali Dai,Z. P. Pra. Shala Antaravali Dai,100
75 - Chapadgaon,Z. P. Pra. Shala Chapadaganv,100
76 - Chapadgaon,Z. P. Pra. Shala Chapadaganv,100
77 - Antarwali Rathi,Z. P. Pra. Shala Antaravali Rathi,100
78 - Talegaon,Z. P. K. Pra. Shala Taleganv,100
79 - Manepuri,Z. P. K. Pra. Shala Manepuri,100
80 - Nipani Pimpalgaon,Z. P. Pra. Shala Nipani Pimpalaganv,100
81 - Raniunchegaon,Zilha Parishad High School Raniunchegaon Room No. 1,100
82 - Raniunchegaon,Zilha Parishad High School Raniunchegaon Room No. 2,100
83 - Raniunchegaon,Zilha Parishad High School Raniunchegaon Room No. 3,100
84 - Raniunchegaon,Z.P.C.Pra. Shala Raniunchegaon,100
85 - Krushnanagar,Z. P. Pra. Shala Krushnanagar,100
86 - Panewadi,Z. P. Pra. Shala Panevadi,100
87 - Panewadi,Z. P. Pra. Shala Panevadi,100
88 - Panewadi,Z. P. Pra. Shala Panevadi,100
89 - Shevagal,Zilha Parishad Primary School Shevagal Room No. 1,100
90 - Shevagal Tanda,Zilha Parishad Primary School Shevagal Tanda Room No. 1,100
91 - Yewala,Z. P. Pra. Shala Yevla,100
92 - Borranjani,Z. P. Pra. Shala Boraranjani,100
93 - Paradgaon,Z. P. Pra. Shala Paradaganv,100
94 - Paradgaon,Z.P.Pra.Sha. Paradgaon,100
95 - Paradgaon,Z.P.Pra.Sha. Paradgaon,100
96 - Paradgaon,Z. P. Pra. Shala Paradaganv,100
97 - Antarwala Bu.,Z. P. Pra. Shala Antaravala Bu.,100
98 - Pangara Tanda,Z. P. Pra. Shala Pangara Tanda,100
99 - Yawalapimpri Tanda,Z. P. Pra. Shala New Building Yavalapimpri Tanda,100
100 - Yawalpimpri,Z. P. Pra. Shala Yavalapimpri,100
101 - Maherjavala,Z. P. Pra. Shala Maherajavala,100
102 - Lamanwadi,Z. P. Pra. Shala Lamanavadi,100
103 - Saraphgavhan,Z. P. Pra. Shala New Building Sarafagavhan,100
104 - Saraphgavhan,Z. P. Pra. Shala Sarafagavhan,100
105 - Awalgaon Bu.,Z. P. Pra. Shala Avalaganv Bu.,100
106 - Awalgaon Bu.,Zilha Parishad Primary School New Building Awalgaon Bu. Room No. 1,100
107 - Awalgaon Khu.,Zilha Parishad Primary School Awalgaon Khu. Room No. 1,100
108 - Shindewadgaon,Z. P. Pra. Shala Shindevadaganv,100
109 - Shindewadgaon,Z. P. Pra. Shala Shindevadaganv,100
110 - Ravna,Zilha Parishad Primary School Ravna Room No. 1,100
111 - Ravna Darga,Z. P. Pra. Shala Darga Sharif,100
112 - Mangujalgaon,Z. P. Pra. Shala Mangujalaganv,100
113 - Mangujalgaon,Z. P. P.S. Mangujalaganv,100
114 - Gurupimpri,Z. P. K. Pra. Shala Gurupimpri East Side,100
115 - Gurupimpri,Z. P. Pra. Shala Gurupimpri West Side,100
116 - Dewadi Hadgaon,Z. P. Pra. Shala Devadihadaganv,100
117 - Jiradgaon,Z. P. C. Pra. Shala Jiradagaon,100
118 - Kandari Partur,Z. P. Pra. Shala Kadari Paratur,100
119 - Kandari Partur,Z. P. Pra. Shala Kadari Paratur,100
120 - Borgaon Khurd,Zilha Parishad Primary School Borgaon Khurd Room No. 1,100
121 - Borgaon Tanda,Zilha Parishad Primary School Borgaon Tanda Room No. 1,100
122 - Dhakephal,Z. P. Pra. Shala Dhakefal,100
123 - Dhakephal,Z. P. Pra. Shala Dhakefal,100
124 - Rajegaon,Z.P.Pra.Sha. Rajegaon,100
125 - Rajegaon,Z.P.Pra.Sha. Rajegaon,100
126 - Bolegaon,Z. P. Pra. Shala Boleganv,100
127 - Mohpuri,Z. P. Pra. Shala Mohapuri,100
128 - Bodhalapuri,Z. P. Pra. Shala Bondhalapuri,100
129 - Bodhalapuri,Z. P. Pra. Shala Bondhalapuri,100
130 - Math Tanda,Z. P. Pra. Shala Mathatanda,100
131 - Kukkadgao,Z. P. Pra. Shala Navin Gaonthan Kukadaganv,100
132 - Lakhmapuri,Z. P. Pra. Shala Lakhamapuri,100
133 - Sukhapuri,Z. P. Ken. Pra. Shala Sukhapuri West Side Kho. Kr.,100
134 - Sukhapuri,Z. P. Ken. Pra. Shala Sukhapuri East Side,100
135 - Belgao,Z. P. Pra. Shala Belaganv,100
136 - Shidheswar Pimpalgaon,Z. P. Pra. Shala Siddheshwar Pimpalaganv,100
137 - Shidheswar Pimpalgaon,Zilha Parishad Primary School Shidheswar Pimpalgaon Room No. 3,100
138 - Wadiramsagaon,Z.P.Pra.Sha. Wadiramasgaon,100
139 - Wadiramsagaon,Z.P.Pra.Sha. Wadiramasgaon,100
140 - Bahiregaon,Z. P. Pra. Shala Bahireganv,100
141 - Ramgavhan Kh.,Z. P. Pra. Shala New Building Ramagavhan Khurd,100
142 - Ghansawangi,Z. P. Pra. Shala Ghanasavangi,100
143 - Ghansawangi,Nagarpanchayat Bulding Ghansawnagi,100
144 - Ghansawangi,Nagarpanchayat Bulding Ghansawnagi,100
145 - Ghansawangi,Nagarpanchayat Bulding Ghansawnagi,100
146 - Ghansawangi,Late.Dadasaheb Deshmukh Z.P.Prashala,100
147 - Ghansawangi,Late.Dadasaheb Deshmukh Zilha Parishad High School Ghansawangi Room No. 2,100
148 - Ghansawangi Tanda,Zilha Parishad Primary School Ghansawangi Tanda Room No. 1,100
149 - Ghansawangi,Z.P.Pra.Sha. Ghansawangi,100
150 - Ghansawangi,Z.P.Pra.Sha. Ghansawangi,100
151 - Devnagar,Zilha Parishad Primary School Devnagar Room No. 1,100
152 - Devnagar Tanda,Zilha Parishad Primary School Devnagar Tanda Room No. 1,100
153 - Pirgaiabwadi,Z.P.Pra.Sha. Pirgaybwadi,100
154 - Pirgaiabwadi,Z.P.Pra.Sha. Pirgaybwadi,100
155 - Dahalegaon,Z. P. Pra. Shala Dahaleganv,100
156 - Ghonsi Bu.,Anganwadi Building Ghonsi Bk.,100
157 - Masegaon,Z. P. Pra. Shala Maseganv,100
158 - Masegaon,Z. P. Pra. Shala Maseganv,100
159 - Hatadi,Z. P. Prashala Hatadi,100
160 - Belwadi,Z. P. Pra. Shala Belavadi,100
161 - Sakalgaon,Z. P. Pra. Shala Sakalaganv,100
162 - Sakalgaon,Z. P. Pra. Shala Sakalaganv,100
163 - Ghonsi Kh.,Z. P. Pra. Shala Ghonsi Khu.,100
164 - Ghonsi Tanda No.1,Z. P. Pra Shala Ghonsi Tanda No. 1,100
165 - Machindranath Chincholi,Z.P.C.Pra.Shala Machhindranath Chincholi,100
166 - Machindranath Chincholi,Z.P.C.Pra.Shala Machhindranath Chincholi,100
167 - Machindranath Chincholi,Zilha Parishad Central Primary School Machindranath Chincholi Room No. 3,100
168 - Machindranath Chincholi,Zilha Parishad Central Primary School Machindranath Chincholi Room No. 4,100
169 - Machindranath Chincholi Wadi,Zilha Parishad Primary School Machindranath Chincholi Wadi Room No. 1,100
170 - Mandala,Z. P. Pra. Shala Mandala,100
171 - Devhivara,Z. P. Pra. Shala Devahivara,100
172 - Rahera,Zilha Parishad Primary School Rahera Room No. 1,100
173 - Tanwadi,Zilha Parishad Primary School Tanwadi Room No. 1,100
174 - Bachegaon,Z. P. Pra. Shala Bacheganv,100
175 - Rui,Zilha Parishad Primary School New Building Room No. 1 Rui,100
176 - Rui,Zilha Parishad Primary School New Building Room No. 2 Rui,100
177 - Wadikalya,Z. P. Pra. Shala Vadikalaya new Building North Sid,100
178 - Wadikalya,Z. P. Pra. Shala Vadikalaya South Side,100
179 - Dadegaon,Z. P. Pra. Shala Dadheganv East Side,100
180 - Dadegaon,Z. P. Pra. Shala Dadheganv West Side,100
181 - Shahapur,Z.P.Pra.Sha. Shahapur East Side Room,100
182 - Shahapur,Z.P.Pra.Sha. Shahapur East Near Side Room,100
183 - Shahapur,Z. P. Pra. Shala Shahpur West Side,100
184 - Baraswada,Z.P.Pra.Sha.South Side Room Baraswada,100
185 - Baraswada,Z.P.Pra.Sha. North Side Room Baraswada,100
186 - Dhakalgaon,Z. P. Pra. Shala Dhakalaganv East Side,100
187 - Dhakalgaon,Zilha Parishad Primary School Dhakalgaon Room No. 2,100
188 - Dhakalgaon,Zilha Parishad Primary School Dhakalgaon Room No. 3,100
189 - Eknathnagar,Zilha Parishad Primary School Eknathnagar,100
190 - Dungaon,Z.P.Pra.Sha. Dungaon South Side Room,100
191 - Dungaon,Z.P.Pra.Sha. Dungaon South Side near Room Dungaon,100
192 - Dungaon,Z.P.Pra.Sha. Dungaon,100
193 - Taka,Z. P. Pra. Shala Taka South Side,100
194 - Taka,Z. P. Pra. Shala Taka North Side,100
195 - Chandanapuri Khurd,Z. P. Pra. Shala Chandanapuri Khurd,100
196 - Ramgavhan Bu,Z. P. Pra. Shala Ramagavhan Bu.,100
197 - Saundalgao,Z. P. Pra. Shala Saudalagav Khurd,100
198 - Dodadgao,Z. P. Pra. Shala Dodadaganv,100
199 - Pithori Sirasagaon,Z.P.Pra.Sha. Hexagonal Room Pithorisirasgaon,100
200 - Pithori Sirasagaon,Z.P.Pra.Sha. North Side Pithorisirasgaon,100
201 - New Pithori Sirasagaon,Zilha Parishad Primary School New Pithori Sirasagaon,100
202 - Revalgaon,Z. P. Pra. Shala Revalaganv,100
203 - Karanjala,Z. P. Pra. Shala Karanjala East Side,100
204 - Karanjala,Z. P. Pra. Shala Karanjala Shatakoni Kholi,100
205 - Bhardi,Z. P. Pra. Shala Bhardi South Side,100
206 - Bhardi,Z. P. Pra. Shala Bhardi North Side,100
207 - Khapardevhiwra,Z. P. Pra. Shala Khaparadevahivara,100
208 - Khapardevhiwra,Z. P. Pra. Shala Khaparadevahivara,100
209 - Bhaygavhan,Z. P. Pra. Shala Bhayagavhan,100
210 - Ekrukha,Z. P. Pra. Shala Akarukha,100
211 - Dahigavhan Bu,Z. P. Pra. Shala Dahigavhan Bu.,100
212 - Bodakha Bu,Z. P. Pra. Shala Bodakha Bu.,100
213 - Bodakha Bu,Z. P. Pra. Shala Bodakha Bu.,100
214 - Khadkawadi,Z. P. Pra. Shala Khadakavadi,100
215 - Sindkhed,Zilha Parishad Primary School Sindkhed North Side Room,100
216 - Devi Dahegaon,Zilha Parishad Primary School Devi Dahegaon New Building Room No. 1,100
217 - Devi Dahegaon,Z. P. Pra. Shala Devidaheganv,100
218 - Gunanaiktanda Tanda,Z. P. Pra. Shala Gunanaik Tanda,100
219 - Kothala Bu,Z. P. Pra. Shala Kothala Bu.,100
220 - Jamsamarth,Z. P. K. Pra. Shala Jambasamarth,100
221 - Jamsamarth,Z. P. Pra Shala Jamb Samarth,100
222 - Bhendala,Z. P. Pra. Shala Bhendala,100
223 - Bangalewadi,Z. P. Pra. Shala Bangalevadi,100
224 - Ghanegaon,Z. P. Pra. Shala Ghaneganv,100
225 - Padulu Khurd,Z. P. Pra. Shala Paduli Khurd,100
226 - Limboni,Z. P. Pra. Shala Limboni,100
227 - Limboni,Z. P. Pra. Shala Limboni,100
228 - Khadka,Z. P. Pra. Shala Khadka,100
229 - Khadka,Z. P. Pra. Shala Khadka,100
230 - Khalapuri,Zilha Parishad Primary School Khalapuri Room No. 1,100
231 - Khalapuri,Zilha Parishad Primary School Khalapuri Room No. 2,100
232 - Dongarwadi,Zilha Parishad Primary School Dongarwadi Room No. 1,100
233 - Murma Khurd,Anganwadi Room No. 1 Murma Khurd,100
234 - Tirthpuri,Z. P. Pra. Shala Tirthapuri Jayakavadi Vasahat,100
235 - Tirthpuri,Z. P. Pra. Shala Tirthapuri Jayakavadi Vasahat,100
236 - Tirthpuri,Z. P. Pra. Shala Tirthapuri,100
237 - Tirthpuri,Z. P. Pra. Shala Tirthapuri,100
238 - Tirthpuri,Z.P.C.Pra.Shala Tirthpuri,100
239 - Tirthpuri,Z.P.C.Pra.Shala Tirthpuri,100
240 - Tirthpuri,Z.P.C.Pra.Shala Tirthpuri,100
241 - Tirthpuri,Z.P.Pra.Sha. Tirthpuri,100
242 - Daithana Khurd,Z. P. Pra. Shala Daithana Khurd,100
243 - Bhanangjalgaon,Z. P. Pra. Shala Bhanang Jalaganv South Side,100
244 - Bhanangjalgaon,Z. P. Pra. Shala Bhanang Jalaganv North Side,100
245 - Eklahera,Z. P. Pra. Shala Akalahera North Side,100
246 - Eklahera,Z. P. Pra. Shala Akalahera South Side,100
247 - Ghungarde Hadgaon,Z. P. Pra. Shala Ghugarde Hadaganv South Side,100
248 - Ghungarde Hadgaon,Z. P. Pra. Shala Ghugarde Hadaganv North Side,100
249 - Ghungarde Hadgaon,Zilha Parishad Primary School Ghungarde Hadgaon Room No. 3,100
250 - Shindewadi,Zilha Parishad Primary School Shindewadi,100
251 - Gondi,Z. P. Pra. Shala (Girls ) Gondi,100
252 - Gondi,Z. P. Pra. Shala (Boys )gondi,100
253 - Gondi,Z. P. Prashala Gondi East Side,100
254 - Gondi,Z. P. Prashala Gondi West Side,100
255 - Gondi,Z.P.Pra.Sha. West Side Gondi,100
256 - Gondi,Z.P.Pra.Sha. West Side Gondi,100
257 - Wadigodri,Z. P. K. Pra. Shala Vadigodri South Side,100
258 - Wadigodri,Z. P. K. Pra. Shala Vadigodri Madhali Kholi,100
259 - Wadigodri,Gram Panchayat OfficeNew Building Wadigodri,100
260 - Antarwali Sarati,Z. P. Pra. Shala Antaravali Sarathi East Side,100
261 - Antarwali Sarati,Z. P. Pra. Shala Antaravali Sarathi West Side,100
262 - Nalewadi,Z. P. Ken. Pra. Shala Nalevadi South Side,100
263 - Nalewadi,Z. P. Kae. Pra. Shala Nalevadi North side,100
264 - Renapuri,Z. P. Pra. Shala Renapuri,100
265 - Bhamberi,Z. P. Pra. Shala Bhamberi East Side,100
266 - Bhamberi,Z. P. Pra. Shala Bhamberi West Side,100
267 - Dahyala,Z. P. Pra. Shala Dahayala,100
268 - Dahyala,Z. P. Pra. Shala Dahayala South Side,100
269 - Churmapuri,Z. P. Pra. Shala Churmapuri North Side,100
270 - Churmapuri,Z. P. Pra. Shala Churmapuri,100
271 - Pathrwala Khurd,Z. P. Pra. Shala Patharavala Khurd North Side,100
272 - Pathrwala Khurd,Z. P. Pra. Shala Patharavala Khurd south Side,100
273 - Hasnapur,Z. P. Pra. Shala Hasanapur,100
274 - Kothala Khurd,Z. P. Pra. Shala Kothala Khurd,100
275 - Sadegaon,Zilha Parishad Primary School Sadegaon Room No. 1,100
276 - Sadegaon,Zilha Parishad Primary School Sadegaon Old Room No. 1,100
277 - Indalgaon,Zilha Parishad Primary School Indalgaon,100
278 - Jogaldevi,Zilha Parishad Primary School Jogaldevi New Room No. 1,100
279 - Ramasgaon,Z. P. Pra. Shala Ramasaganv,100
280 - Ramasgaon,Z. P. Pra. Shala Ramasaganv,100
281 - Kandari Ambad,Z. P. Pra. Shala Kandari Ambad,100
282 - Paduli Bu,Z. P. Pra. Shala Paduli Bu.,100
283 - Pimparkhed Bu,Z. P. Pra. Shala Pimparakhed Bu. East Side,100
284 - Pimparkhed Bu,Z. P. Pra. Shala Pimparakhed Bu. West Side,100
285 - Pimparkhed Bu,Z. P. Pra. Shala Pimparakhed Bu. West Side,100
286 - Aragadegavhan,Z. P. Pra. Shala Argade Gavhan,100
287 - Kumbhar Pimpalgaon,Z. P. C. Pra.Shala Kumbhar Pimpalagaon,100
288 - Kumbhar Pimpalgaon,Z. P. C. Pra.Shala Kumbhar Pimpalagaon,100
289 - Kumbhar Pimpalgaon,Z.P.Pra.Shala Nutan Vasahat Kumbharpimpalgaon,100
290 - Kumbhar Pimpalgaon,Z.P.Pra.Shala Nutan Vasahat Kumbharpimpalgaon,100
291 - Kumbhar Pimpalgaon,Z. P. C. Pra.Shala Kumbhar Pimpalagaon,100
292 - Limbi,Z. P. Pra. Shala Limbi,100
293 - Viregavhan Tanda,Z. P. Pra. Shala Viregavhan Tanda,100
294 - Shirpat Dhamangaon,Z. P. Pra. Shala Shripat Dhamanaganv,100
295 - Murti,Z. P. Pra. Shala Murti Kholi Kran. 3,100
296 - Murti,Z. P. Pra. Shala Murti,100
297 - Rajatakali,Z. P. Pra. Shala Rajatakali,100
298 - Rajatakali,Z. P. Pra. Shala Rajatakali,100
299 - Rajatakali,Z. P. Pra. Shala Rajatakali,100
300 - Rajurkarkotha,Z. P. Pra. Shala Rajurkar Kotha East Side,100
301 - Antarwali Tembhi,Z. P. Pra. Shala Antaravali Tembhi North side,100
302 - Antarwali Tembhi,Z. P. Pra. Shala Antaravali Tembhi South Side,100
303 - Antarwali Tembhi,Z. P. Pra. Shala Antaravali Tembhi,100
304 - Shevta,Z. P. Pra. Shala Shewta,100
305 - Banegaon,Z. P. Pra. Shala Baneganv,100
306 - Banegaon,Z. P. Pra. Shala Baneganv,100
307 - Gangachincholi,Z. P. Pra. Shala Gangachincholi,100
308 - Kuran,Z. P. Pra. Shala Kuran,100
309 - Patharwala Bu,Z. P. Ken. Pra. Shala Patharavala Bu. North Side,100
310 - Patharwala Bu,Z. P. Ken. Pra. Shala Patharavala Bu. East Side,100
311 - Patharwala Bu,Z. P. Ken. Pra. Shala Patharavala Bu. South Side,100
312 - Walkeshwar,Z.P.Pra.Sha.East Side Room Walkeshwar,100
313 - Walkeshwar,Z.P.Pra.Sha. Walkeshwar,100
314 - Shahagad,Z. P. Prashala West Side Shahagad,100
315 - Shahagad,Z. P. Prashala East Side Shahagad,100
316 - Shahagad,Z. P. Prashala West Side Madhali Kholi Shahagad,100
317 - Shahagad,Gramapanchayat Karyalay Shahagad,100
318 - Shahagad,Z. P. Prashala North Side Shahagad,100
319 - Gandhari,Z. P. Pra. Sha . Gandhari,100
320 - Domalgaon,Z. P. Pra. Shala Domalaganv,100
321 - Mahakala,Z.P.Pra.Sha. Mahakala East Side,100
322 - Mahakala,Z.P.Pra.Sha. Mahakala East Side,100
323 - Mahakala,Z.P.Pra.Sha. Mahakala West Side,100
324 - Mahakala,Z.P.Pra.Sha. Mahakala West Side,100
325 - Mahakala,Z.P.Pra.Sha. Mahakala South Side Room,100
326 - Mahakala,Z. P. Pra. Shala Mahakala Hexagonal Kholi,100
327 - Mahakala,Gramapanchayat Karyalay Mahakala,100
328 - Sashtpimpalgaon,Z. P. Pra. Shala Sashtapimpalaganv West Side,100
329 - Sashtpimpalgaon,Z.P.Pra.Sha. Sa. Pimpalgaon South Side,100
330 - Sashtpimpalgaon,Z.P.Pra.Sha. Sa. Pimpalgaon North Side,100
331 - Sashtpimpalgaon,Z.P.Pra.Sha.Indiranagar Sashta Pimpalgaon East Side,100
332 - Balegaon,Z. P. Pra. Shala Baleganv,100
333 - Apegaon,Z. P. Pra. Shala Apeganv,100
334 - Saundalgaon Bu,Zilha Parishad Primary School Saundalgaon Bu Room No. 1,100
335 - Vitthalnagar,Zilha Parishad Primary School Vitthalnagar Room No. 1,100
336 - Kothi,Anganwadi Building No.2,100
337 - Mudregaon,Z. P. Pra. Shala Mudreganv,100
338 - Ukkadgaon,Z. P. Pra. Sha. Ukadaganv,100
339 - Gunj Bu,Z. P. Pra. Shala Gunj Bk.,100
340 - Gunj Bu,Z. P. C. Pra Shala Gunj Bk.,100
341 - Gunj Bu,Z. P. C. Pra Shala Gunj Bk.,100
342 - Nagobachi Wadi,Z. P. Pra. Shala Nagobachi Wadi,100
343 - Nagobachi Wadi,Z. P. Pra. Shala Nagobachi Wadi,100
344 - Bhadali,Z. P. Pra. Shala Bhadli,100
345 - Bhadali,Z. P. Pra. Shala Bhadli,100
346 - Shivangaon,Z. P. Pra. Shala Shivanaganv,100
347 - Shivangaon,Z. P. Pra. Shala Shivanaganv,100
348 - Mangrul,Anganwadi Building Mangarul,100
349 - Mangrul,Mangal Karyalay Grampanchayat Mangarul,100
350 - Mangrul,Grampanchayat Office Mangrul,100
351 - Bhoggaon,Z. P. Pra. Shala Bhogaganv,100
352 - Bhoggaon,Z. P. Pra. Shala Bhogaganv,100
