PS No & Name,Address,Constituency Number
1 - Hadkaichond,Zilla parishad Primary School Hadkaichond East Room No.1,117
2 - Chinchle,Zilla parishad primary Shcool Chinchle East Side Room No.1,117
3 - Kelipada,Zilla parishad primary School Kelipada Room No.1,117
4 - Chandrapur,Zilla parishad primary School Chandrapur Room No.1,117
5 - Punadnagar (Bhauti),"Zilla parishad primary school, Punadnagar Room No.1",117
6 - Hanumantmal,Anganwadi Building Room No.1,117
7 - Kharde digar,"Zilla parishad Primary School,Kharde digar North side Room No.1",117
8 - Umbargawhan,"Zilla parishad primary school,Umbargawhan Room No.1",117
9 - Kukudne,Zilla parishad primary Shcool Kukudne South Side Room No.1,117
10 - Chinchpada,Zilla parishad primary School Chinchpada North Side Room No.1,117
11 - Bhadarpada,Zilla parishad primary School Bhadarpada Room No.1,117
12 - Pangarne,Zilla parishad primary Shcool Pangarne East Side Room No.1,117
13 - Pangarne,Zilla parishad primary Shcool Pangarne East Side Room No.2,117
14 - Pimpasond,Zilla parishad primary School Pimpalsond West Side Room. No.1,117
15 - Chapawadi,Zilla parishad primary School Chapadawadi North Side Room No,117
16 - supale digar,"Zilla parishad primary school,Supale digar Room No.1",117
17 - Pratapnagar,"zilla parishad primary school, pratapnagar, (Devnali) Digital building .",117
18 - Kathare digar,"Zilla parishad primary school,Kathare digar Room No.1",117
19 - Bhutane digar,"Zilla parishad primary school,Bhutane digar Room No.1",117
20 - Malgaon Khurd,Zilla Parishad Primary School Malgaon Khurd Room No. 1,117
21 - Malgaon Budruk,Zilla Parishad Primary School Malgaon Budruk Room No. 1,117
22 - Gopalnagar,Zilla parishad primary School Gopalnagar Room No.1,117
23 - Galbari,Zilla parishad primary School Galbari East Side Room No.1,117
24 - Sundarban,Zilla parishad primary School Sundarbar East Side Room No.1,117
25 - Ragatvihir,Zilla parishad primary School Ragatvihir West Side Room No 1,117
26 - Naikpada,Zilla parishad primary School Naikpada Room No.1,117
27 - Phanashpada,Zilla parishad primary School Phanashpada East Side Room No,117
28 - Mandha,Zilla parishad primary School Mandha East Room No.1,117
29 - Guhi (Jambhulpada),Zilla Parishad Primary School Guhi (Ja) North Side Room,117
30 - Jambhulpada (Guhi),Zilla parishad primary School Jambhulpada (Guhi) Room No.1,117
31 - Karajul (K),Zilla parishad primary School Karanjul (K) South Side Room No 1,117
32 - Borchonda,Zilla parishad primary School Borchond Room No.1,117
33 - Khuntvihir,Zilla parishad primary School Khuntvihir Room No.1,117
34 - Gaundagad,Zilla parishad primary School Gaundagad West Side Room No.1,117
35 - Udaldari,Zilla parishad primary School Udaldari Room No.1,117
36 - Karajul (Su),Zilla parishad primary School Karanjul Su South Side Room No 1,117
37 - Devaldari,Zilla parishad primary School Devaldari East Side Room No.1,117
38 - Walutzira,Zilla parishad primary School Walutzira Room No.1,117
39 - Dolhare,Zilla parishad primary School Dolhare North Side Room No.1,117
40 - Subhashnagar,Zilla parishad primary School Subhashnagar Room No.1,117
41 - Rasha,"Zilla parishad primary School Rasha South Side Room No,1",117
42 - Ganore,"Zilla parishad Primary School,Ganore south north building North side Room No.2",117
43 - Ganore,"Zilla parishad Primary School,Ganore south north building South side Room No.2",117
44 - Hundyamokh,"Zilla parishad primary school, HundyamokhRoom No.1",117
45 - Dahyane digar,"Zilla parishad primary school,Dahyane digar Room No.1",117
46 - Pimple budruk,"Zilla parishad primary school,Pimple burduk Room No.1",117
47 - Sawarpada,"Zilla parishad primary school,Sawarpada, south-North Building",117
48 - Khadaki,"Zilla parishad Primary School, Khadaki West side New Room No 1",117
49 - Koswan,"Zilla parishad primary school,Koswan Room No.1",117
50 - Mulkhundapada (Koswan),"Zilla parishad primary school,Bagulhuda Room No.1",117
51 - Wirshet,"Zilla parishad Primary School,Wirshet South side Room No.1",117
"52 - ""MANGLIDAR ( Virshet )",jilla parishad Prathamik Shala Mangali dar Room No.1,117
53 - Punegao,"Zilla parishad Primary School,Punegaw North side Room No.1",117
54 - Jaydar,"Zilla parishad primary school, JaydarRoom No.1",117
55 - Sule,"Zilla parishad Primary School,Sule East side Hexagon Room No.1",117
56 - Dhaner digar,"Zilla parishad Primary School,Dhaner digar East side Room No.1",117
57 - Darebhanagi,"Zilla parishad primary school, DarebhanagiRoom No.1",117
58 - Umbarthan,"Zilla Parishad Primary school Umbarthan, East Side, Room No. 1",117
59 - Wadpada,Zilla parishad primary School Wadpada South Room No.1,117
60 - Umbathan (Ni),"Zilla Parishad Primary school Umbarthan (Ni), Room No. 1",117
61 - Kathipada,Zilla parishad primary School Kathipada South Room No.1,117
62 - Payarpada (K),"Zilla Parishad Primary School Payarpada East Side, Room No.1",117
63 - Ambatha,Zilla parishad Primary School Ambatha South Side Room No.1,117
64 - Santkhamb,Zilla parishad primary School Santkamb Room No.1,117
65 - Kothula,Zilla parishad primary School Kothula East Side Room No.1,117
66 - Bhormal (Mo),Aadhivashi ashram secondry school bhormal East Side Room No. 1,117
67 - Bhormal (La),Zilla parishad primary Schooll Bhormal (La) West Side Room N,117
68 - Umbarpada (Su),Zilla parishad primary School Umbarpada East Side Room No.1,117
69 - Palvihir,Zilla parishad primary School Palvihir Room No.1,117
70 - Bhawandagad,Zilla parishad primary School Room No.1,117
71 - Bhadarpada,Zilla parishad primary School Bhadar North Side Room No.1,117
72 - Satbhabal,Zilla parishad primary School Satbhabal Room No.1,117
73 - Wisapur,"Zilla parishad primary school, south, room no.1",117
74 - Bijore,"Zilla parishad Primary School, south, Bijore south side room no.1",117
75 - Mokbhanagi,"Maratha vidya prasarak Mandlache Mahatma Phule High School,Mokbhangi, North side room No.2",117
76 - Mokbhanagi,"Maratha vidya prasarak Mandlache Mahatma Phule High School,Mokbhangi, North side room No.4",117
77 - Desrane,"Zilla parishad primary school,Wast, room no.1",117
78 - Desrane,"Zilla parishad primary school, East, room no.3",117
79 - Nalid,"Zilla parishad primary school,Nalid, Room No.1",117
80 - Bhandane pimple,"Zilla parishad Primary School,east, Bhandane pimple, North side Room No.",117
81 - Dharde digar,"Zilla parishad Primary School,new building, dharde digar North side Room no.1",117
82 - Paadgan,"Zilla parishad primary school, North side, room no.2",117
83 - Pimple khurd,"Zilla parishad Primary School, Pimpale khurd North south Building south side hexagon room",117
84 - Lakhani,"Zilla parishad Primary School, lakhani, East West Building West side Room No.1",117
85 - Mohbari,"Zilla parishad primary school,mohbari, south-north Building R",117
86 - Ambapur,"Zilla parishad primary school,east, Ambapur, Room No.1",117
87 - Mothamal,Zilla parishad primary School Mothamal West Side Room No.1,117
88 - Shribhuwan,Zilla parishad primary School Shribhuwan West Side Room No.1,117
89 - Balozar,Zilla parishad primary School Balozar Room No.1,117
90 - Karvande,Zilla parishad primary School Karvande West Side Room No.,117
91 - Durgapur,Zilla parishad primary Durgapur Room No.1,117
92 - Surgana,Zilla parishad primary School Surgana East Side Room No.1,117
93 - Surgana,Zilla parishad primary School Surgana East Side Room No.4,117
94 - Surgana,Zilla parishad primary School Surgana North Side Room No.02,117
95 - Surgana,Zilla parishad primary School Surgana North Side Room No.4,117
96 - Surgana,Nutan Vidyamandir Surgana South Side Room No.1,117
97 - Talpada,Zilla parishad primary School Talpada Room No.1,117
98 - Khokari,Zilla parishad primary School Khokari West Side Room No.2,117
99 - Nimbarpada,Zilla parishad primary School Nimbarpada Room No.1,117
100 - Alangun,Zilla parishad primary School Alangun West Side Room No.2,117
101 - Alangun,Zilla parishad primary School Alangun West Side Room No.1,117
102 - Torandongari,Zilla parishad primary School Torandongari East Side Room No.,117
103 - Baflun,Zilla parishad primary School Baflun Room No.1,117
104 - Mishkhadak,Zilla parishad primary School Maishkhadak West Side Room No.1,117
105 - Dodipada,Zilla parishad primary Dodipada Room No.1,117
106 - Werule,"Zilla parishad primary school, Werule, New Building, Room No",117
107 - Bhandane hatgad,"Zilla parishad primary school,Bhandane hatgad, Room No.1",117
108 - Jirwade ha,"Zilla parishad primary school,jirwade hatgad, Room No.1",117
109 - Kumsadi,"Zilla parishad primary school,Kumsadi, south-north Building R",117
110 - Bapkheda,"Zilla parishad primary school, North side, baapkheda room no.",117
111 - Dhanoli,"Zilla parishad primary school,dhanoli,, Room No.1",117
112 - Shepupada,"Zilla parishad Primary School, shepupada, south side room no 1",117
113 - Tatani,"Zilla parishad Primary School,tatani, East side,Room No.1",117
114 - Daregao hatgad,"Zilla parishad primary school,Daregao hatgad south side,Room",117
115 - Dalwat,"Zilla parishad primary school,dalwat, east side,Room No.1",117
116 - Dalwat,"Zilla parishad primary school,dalwat, North side,Room No 1",117
117 - Shingashi,"Zilla parishad primary school,shingashi, south side Room No.1",117
118 - Warkheda,"Zilla parishad Primary School,warkheda, East side Room No 1",117
119 - Karmale,"Zilla parishad Primary School,Karmale, South-north Building North side room 1",117
120 - Golakhal,"Zilla parishad primary school, golakhal, south side,Room No.1",117
121 - Golakhal,"Zilla parishad primary school, golakhal, south side,Room No.2",117
122 - Inshi,"Zilla parishad primary school, inshi, north side,,Room No.2",117
123 - Rawalji,"Zilla parishad primary school,rawalji, west side, Room No.1",117
124 - Rawalji,"Zilla parishad primary school, rawalji, west side,Room No.2",117
125 - Chacher,"Zilla parishad primary school,chacher, north side, Room No.1",117
126 - Pilkos,"Zilla parishad primary school,East, Room No.1",117
127 - Pilkos,"Zilla parishad primary school,pilkos, Wasat Room No.2",117
128 - Bhadwan,"Zilla parishad primary school,bhadwan, south side, Room No.1",117
129 - Paatwihir,"Zilla parishad Primary School,patwihir, North side, Room No.1",117
130 - Khedgao,"Zilla parishad primary school,khedgao, Room No.1",117
131 - Kakane,"Zilla parishad primary school,Kakane, Room No.1",117
132 - Wangan Su,Zilla parishad primary School Wangan (Su) South Side Room No.,117
133 - Sule (Wa),Zilla parishad primary School Sule West Side Room No.2,117
134 - Hatrundi,Zilla parishad primary School Hatrundi West Side Room No.1,117
135 - Hatrundi,Zilla parishad primary School Hatrundi West Side Room No.2,117
136 - Pratapgad,Zilla parishad primary School Pratapgad East Side Room No.1,117
137 - Suryagad,Zilla parishad primary School Suryagad Room No.1,117
138 - Ganeshnagar,"Zilla Parishad Primary School Ganeshnagar North South Building, Room No. 1 from South",117
139 - Khadakmal,"Zilla Parishad Primary School Khadakmal North South Building, Room No. 1 from South",117
140 - Umbarvihir,Zilla parishad primary School Umbarvihir South Side Room No.1,117
141 - Malgavan,Zilla parishad primary School Malgavan West Side Room No.1,117
142 - Udaypur,Zilla parishad primary School Udaypur Room No.1,117
143 - Alivpada,Zilla parishad primary School Alivpada West Side Room No.1,117
144 - Garmal,Zilla parishad primary School Garmal East Side Room No.1,117
145 - Bubli,Zilla parishad primary School Bubali West Side Room No.1,117
146 - Umaremal,"Zilla Parishad Primary School Umremal, Room No.1 from North",117
147 - Ladgaon,"Zilla Parishad Primary School Ladgaon, North South Building, Room No.3 from North",117
148 - Hatti,"Zilla Parishad Primary School Hatti, East West Building, Room No. 2 from West",117
149 - Hatgad,Zilla parishad primary School Hatgad South Side Room No.2,117
150 - Hatgad,Zilla parishad primary School Hatgad South Side Room No.1,117
151 - Dhekale,"Zilla parishad primary school,dhekale, west side Building Roo",117
152 - Balapur,"Zilla parishad primary school, balapur, south north Building",117
153 - Kanashi,"Zilla parishad primary school,kanashi, east side, Room No.1",117
154 - Kanashi,"Zilla parishad primary school,kanashi, west side, Room No.1",117
155 - Gangapur,"Zilla parishad Primary School,,Gangapur, east side hexagoan room",117
156 - Karambhel kanashi,"Zilla parishad Primary School,karambhel kanashi, south north building south side room no 1",117
157 - Khadakwan,"Zilla parishad primary school, Room No.1",117
158 - Karambhel hatgad,"Zilla parishad Primary School, karmbhel Hatgad New Building North side Room No.1",117
159 - Bhakurde,"Zilla parishad primary school,New Building Bhakurde, Room No.",117
160 - Kosurde,"Zilla parishad primary school, Kosurde, east-west buildng Roo",117
161 - Aamdar,"Zilla parishad Primary School, aadar east side Room No.1",117
162 - Lingame,"Zilla parishad Primary School, Lingame south side Room No.2",117
163 - Payarpada (H),Zilla parishad primaryschool Payarpada North Side Room No.01,117
164 - Sajole,Zilla parishad primary School Sajole North Side Room No.1,117
165 - Pohali,Zilla parishad primary School Pohali South Side Room No.01,117
166 - Nagshevadi,Zilla parishad primary School Nagshevadi North Side Room No.0,117
167 - Nagshevadi,Zilla parishad primary School Nagshevadi North Side Room No.0,117
168 - Wanjulpada,Zilla parishad primary School Wanjulpada Room No.1,117
169 - Ahamadgavan,Zilla parishad primary School Ahamadgavan South Side Room No.,117
170 - Vavarpada,Zilla parishad primary School Vavarpada Room No.1,117
171 - Mani,Zilla parishad primary School Mani East Side Room No.01,117
172 - Hanumanatmal,Zilla parishad primary School Hanumantmal East Side Room No.0,117
173 - Khobla (Ma),Zilla parishadPriamary School Khobla (Ma) East Side Room No.,117
174 - Amda (P),Zilla parishad primary School Amda (P) East Side Room No.01,117
175 - Bhawada,Zilla parishad primary School Bhawada West Side Room No.01,117
176 - Amda (Ba),Zilla parishad primary School Amda (Ba) Room No.1,117
177 - Dudhaval,Zilla parishad primary School Dudhaval West Side Room No.2,117
178 - Palsan,Zilla parishad primary School Palsan West Side Room No.01,117
179 - Payarpada (P),Zilla parishad primary School Payarpada (P) East Side Room No,117
180 - Kukudmunda,Zilla parishad primaryschool Kukadmunda East Side Room No.01,117
181 - Ambaddahad,Zilla parishad primary School Ambaddahad Room No.1,117
182 - Bival,Zilla parishad primary School Biwal West Side Room,117
183 - Bival,Zilla parishad primary School Biwal East Side Room,117
184 - Bhintghar,Zilla parishadPriamary School Bhintghar East Side Room No.01,117
185 - Waghdhond,Zilla parishad primary School Waghdhond East Side Room No.01,117
186 - Sabardara,Zilla parishad primary School Sabardara Room No.1,117
187 - Mohpada,Zilla parishad primary School Mohapada South Side Room No.01,117
188 - Ghodambe,Zilla parishad primary School Ghodambe North Side Room No.01,117
189 - Borgaon,Zilla parishad primary School Borgaon East Side Room No.02,117
190 - Borgaon,Zilla parishad primary School Borgaon East Side Room No.01,117
191 - Kharude,Zilla parishad primary School Kharude East Side Room No.01,117
192 - Chikhali,Zilla parishad primary School Chikhali East Side Room No.01,117
193 - Khirad,"Zilla parishad Primary School,Khirad south side Room No.1",117
194 - Desgaon,"Zilla parishad Primary School, Desgaon east Side Building south side Room No1",117
195 - Bendipada,"Zilla parishad Primary School,Bendipada North side Room No.1",117
196 - Sarledigar,"Zilla parishad primary school, Room No.1",117
197 - Jaypur,"Zilla parishad primary school, south side,Room No.1",117
198 - Gosrane,"Zilla parishad Primary School, Gosrane Hexagoan Room",117
199 - Hingawe,"Zilla parishad Primary School, Hingave North side roon No 2",117
200 - Gopalkhadi,"Zilla parishad Primary School, gopalkhadi, East side room no.1",117
201 - Wadi budruk,"Zilla parishad Primary School, wadi Bu. South side,Room No.1",117
202 - Eklahare,"Zilla parishad primary school. Eklahare, north-south building",117
203 - Nakode,"Zilla parishad Primary School, Nakode North side room no.1",117
204 - Juni bej,"Maratha vidya prasarak Mandlache Mahatma Phule High School,JuniBej, North side room No.1",117
205 - Juni bej,"Maratha vidya prasarak Mandlache Mahatma Phule High School,JuniBej, North side room No.3",117
206 - Bagadu,"Zilla parishad Primary School, Bagadu West side room no.1",117
207 - Bhendi,"Zilla parishad Primary School Bhendi, south side east west building west side room no.2",117
208 - Bhendi,"Zilla parishad Primary School Bhendi, North side East West building West side room no.1",117
209 - Nawi bej,"Zilla parishad Primary School Navibej, West side room no.1",117
210 - Nawi bej,"Zilla parishad Primary School Navibej, East side room no.",117
211 - Kalwan Budruk,Zilla parishad Primary School Ram Nagar Kalwan Budruk New Building East Side Room No.1,117
212 - Kalwan Budruk,Zilla parishad Primary School Ram Nagar Kalwan Budruk New Building East Side Room No.2,117
213 - Kalwan budruk,"Zilla parishad Primary School, Kalwan Bu. east-west side, building East side room no.1 Shivajinagar (Boys School)",117
214 - Kalwan budruk,"Zilla parishad primary school, ganeshnagar,East room no.1",117
215 - Kalwan budruk,"Zilla parishad primary school, ganeshnagar,West room no.1",117
216 - Kalwan budruk,"Zilla parishad primary school, ganeshnagar, North room no.1",117
217 - Kalwan budruk,"Zilla parishad primary school, old building, room no.1 (girl)",117
218 - KALWAN BU,Zilla parishad Primary School Kalwan Bu Girls No.2 South Side Room no.2,117
219 - KALWAN BU,Zilla parishad Primary School Kalwan Bu Girls No.2 North Side Room no.1,117
220 - Kalwan budruk,"Zilla parishad Semi english school, (Girls) East side, room 1",117
221 - Kalwan budruk,"Zilla parishad Semi english school, (Girls School) west side room no 1",117
222 - Kalwan budruk,"Zilla parishad primary school, (girl), old building, room no.",117
223 - Kalwan budruk,"Zilla parishad primary school, (girl) Room No.1",117
224 - Kalwan budruk,"Zilla parishad primary school, (girl), room no.2, ground floo",117
225 - Pale khurd,"Zilla parishad primary school Pale khurd,east room no.1",117
226 - Pale khurd,"Zilla parishad Primary School Pale khurd,east side room no.3",117
227 - Abhona,"Zilla parishad primary school Abhona,room no.1",117
228 - Abhona,"Zilla parishad primary school Abhona,room no.2",117
229 - Abhona,"Zilla parishad Primary School Abhona, West side,room no.1",117
230 - Bhagurdi,"Zilla parishad Primary School Bhagurdi,Hexagoan room",117
231 - Dattanagar,"Zilla parishad Primary School, Dattnagar south-north Building North side room no.1",117
232 - Chankapur,"Zilla parishad primary school,room no.1",117
233 - Mohmukh,"Zilla parishad primary school,room no.1",117
234 - Tirhal budruk,"Zilla parishad Primary School,Tirhal Bu. Hexagoan room",117
235 - Tirhal khurd,"Zilla parishad Primary School, Tirhal Khurd Hexagoan Room",117
236 - Dewali karhad,"Zilla parishad primary school, south north building room no.1",117
237 - Wadale hatgad,"Zilla parishad primary school, wadale hatgad,room no.1",117
238 - Hiridpada,Zilla parishad primary School Hiridpada Room No.1,117
239 - Harantekadi,Zilla parishad primary School Harantekadi North Side Room No.,117
240 - Shinde,Zilla parishad primary School Shinde North Side Room No.01,117
241 - Shinde,Zilla parishad primary School Shinde North Side Room No.02,117
242 - Pangarbari,Zilla parishad primary School Pangarbari Room No.01,117
243 - Umbarde (Ma),Zilla parishad primary School Umbarde (Ma) South Side Room No,117
244 - Palshet,Zilla parishad primary School Palshetnwest Side Room No.01,117
245 - Gahale,Zilla parishad primary School Gahale West Side Room,117
246 - Gahale,Zilla parishad primary School Gahale East Side Room,117
247 - Karanjul (Pe),Zilla parishad primary School Karanjul Pe West Side Room No.0,117
248 - Thangaon,"Zilla Parishad Primary School Thangaon, North South Building, South Side Room No.1",117
249 - Gopalpur,Zilla parishad primary School Gopalpur East Side Room No.01,117
250 - Waghnakhi,Zilla Parishad Primary School Waghnakhi North Side Room,117
251 - Gurtembhi,Zilla Parishad Primary School Gurtembhi South Side Room No.1,117
252 - Ronghane,Zilla parishad primary School Roghane East Side Room No.01,117
253 - Shirishpada,Zilla parishad primary School Shirishpada East Side Room No.0,117
254 - Sukapur,"Zilla parishad Primary School, sukapur West side Hexagoan Room",117
255 - Wadpada,"Zilla parishad primary school Wadpada, north-south New Buildi",117
256 - Palasdar,"Zilla parishad Primary School,Palasdar, West side room no 1",117
257 - Mohpada,"Zilla parishad Primary School,Mohpada, North side room no.1",117
258 - Bordaiwat,"Zilla parishad primary school,room no.1",117
259 - Ozar,"Zilla parishad primary school, east west building room no.1",117
260 - Ambika ozar,"Zilla parishad primary school, ambika ozar, room no.1",117
261 - Amburdi Budruk,Zilla parishad Primary School Amburdi Budruk East Side New Building Room No.1,117
262 - Chinchore,"Zilla parishad Primary School,Chinchore, south north room no",117
263 - Jaamshet,"Zilla parishad Primary School Jaamshet, Aanganwadi room",117
264 - Wanjari,"Zilla parishad primary school,room no.1",117
265 - Withewadi pale,"Zilla parishad primary school,room no.1",117
266 - Kalamthe,"Zilla parishad primary school,kalamthe, room no.1",117
267 - Pale budruk,"Zilla parishad primary school,room no.1",117
268 - Manur,"Zilla parishad Primary School,manur West side room no.4",117
269 - Manur,"Zilla parishad primary school,room no.2",117
270 - Kalwan khurd,"Zilla parishad Primary School, Kalwan Khurd south north building East side New room no.1",117
271 - Niwane,"Zilla parishad primary school,room no.1",117
272 - Niwane,"Zilla parishad primary school,room no.2",117
273 - Niwane,"Zilla parishad Primary School,Niwane West side room no.",117
274 - Bhusani,"Zilla parishad primary school,room no.1",117
275 - Dahyane Otur,"Zilla parishad primary school,dahyna eotur room no.1",117
276 - Jirwade otur,"Zilla parishad primary school,room no.1",117
277 - SHIRASAMANI,Zilla parishad Primary School Shirasamani New South Side Building East Side Room no.2,117
278 - Sakore,"Zilla parishad Primary School, Sakore North south building, North side room no.1",117
279 - Sakorepada,"Zilla parishad primary school, sakorepada, room no.1",117
280 - Gobapur,"Zilla parishad primary school Gobapur,room no.1",117
281 - Katalgao,"Zilla parishad Primary School Katalgaon, south north building North side room no.2",117
282 - Kundane kanashi,"Zilla parishad primary school Kundane K,room no.1",117
283 - Dewali Wani,Zilla parishad Primary School Dewali Wani New Building Room No.1,117
284 - Jamle wani,"Zilla parishad primary school Jamale v,room no.1",117
285 - Chinchpada,"Zilla parishad primary school, chinchpada, south-north New Bu",117
286 - Chikadi,Zilla parishad primary School Chikadi East Side Room No.01,117
287 - Pilukpada,Zilla parishad primary School Pilukpada East Side Room No.01,117
288 - Salbhoye,Zilla parishad primary School Salbhoye East Side Room No.01,117
289 - Rokadpada,Zilla parishad primary School Rokadpada East Side Room No.01,117
290 - Kumbhipada,Zilla parishad primary School Kumbhipada Room No.1,117
291 - Sarad,Zilla parishad primary School Sarad North Side Room No.01,117
292 - Umbarpada (Di),Zilla parishad primary School Umbarpada (Di) East Side Room N,117
293 - Sanjaynagar,Zilla parishad primary School Sanjaynagar,117
294 - Rahude,Zilla parishad primary School Rahude East Side Room No.01,117
295 - Jayvihir,Zilla parishad primary School Jayvihir East Side Room No.01,117
296 - Mankhed,Zilla parishad Primary School Mankhed Room No.2,117
297 - Sadudne,Zilla parishad primary School Sadudne Room No.1,117
298 - Sambarkhal,Zilla parishad primary School Sambarkhal South Side Room No.0,117
299 - Jambhulpada (Da),Zilla parishad primary School Jambhulpada (Da) room No.1,117
300 - Bedse,Zilla parishad primary School Bedse West Side Room No.01,117
301 - Kodipada,Zilla parishad primary School Kodipada South Side Room NO.01,117
302 - Ambode,"Zilla Parishad Primary School Ambode, North South Building, South Side Room No.02",117
303 - Sarmal,Zilla parishad primary School Sarmal East Side Room No.01,117
304 - Khadaki Digar,Zilla Parishad Primary School Khadki Di East Side Room No.1,117
305 - Kothambhi,Zilla parishad primary School Kothambhi West Side Room No.01,117
306 - Bahre,"Zilla Parishad Primary & Higher Primary Centre School Bahre, East West Building, Room No.02 from East",117
307 - Gadga,Zilla parishad primary School Gadga Room No.1,117
308 - Bhegu,Zilla parishad primary School Bhegu East Side Room No.01,117
309 - Sayalpada,Zilla parishad primary School Sayalpada Room No.1,117
310 - Suktale,Zilla parishad primary School Suktale North Side Room No.01,117
311 - Hemadpada,Zilla parishad primary School Hemadpada Room No.1,117
312 - Mangdhe,Zilla parishad primary School Mangdhe Nurth Side Room No.02,117
313 - Mangdhe,Zilla parishad primary School Mangdhe Nurth Side Room No.01,117
314 - Varambhe,Zilla parishad primary School Varambhe Sout Side Room No.01,117
315 - Jahule,Zilla parishad primary School Jahule East Side Room No.01,117
316 - Haste,Zilla parishad primary School Haste Room No.1,117
317 - Bilwadi,"Zilla parishad primary school,room no.1",117
318 - Mohandari,Zilla parishad Primary School Mohandari New Building Room No.1,117
319 - Daregao wani,"Zilla parishad primary school,east room no.1",117
320 - Nanduri,"Zilla parishad primary school,west room no.1",117
321 - Athambe,"Zilla parishad primary school Athambe,room no.1",117
322 - Shirasamani,Zilla parishad Primary School Shirasamani New South Side Building East Side Room No.1,117
323 - Kundane otur,"Zilla parishad primary school Kundane otur,room no.1",117
324 - Otur,"Zilla parishad Primary School Otur,East west building west side room no.1",117
325 - Otur,"Zilla parishad primary school Otur,room no.2",117
326 - Pimpri pale,"Zilla parishad Primary School Pimpari Pale, East side Hexgoan Room no 1",117
