PS No & Name,Address,Constituency Number
327 - Pimpri Markand,"Zilla parishad Primary School pimpari Markad,North side Hexagoan room no.1",117
328 - Saptashrung gad,"Zilla parishad primary school Saptarsrungi gad,room no.1",117
329 - Saptashrung gad,"Zilla parishad primary school Shaparshrungi gad,room no.2",117
330 - Mulane Wani,Zilla parishad Primary School Mulane Wani New Building Room No.1,117
331 - Narul,"Zilla parishad primary school Narul, West side building room no.1",117
332 - Kanherwadi,"Zilla parishad primary school Kaneharwadi,room no.2",117
333 - Mehdar,"Zilla parishad primary school Mehadar,room no.1",117
334 - Wadale wani,"Zilla parishad primary school,room no.1",117
335 - Khirmani,"Zilla parishad primary School Khirmani South, North Side Room",117
336 - Kalmane,Zilla parishad primary School Kalmane room No.1,117
337 - Khokarvihir,Zilla parishad primary School Khokarvihir East Side Room No.0,117
338 - Bhenshet,Zilla parishad primary School Bhnshet East Side Room No.01,117
339 - Khobala Di,Zilla parishad primary School Khobla Di South Side Room No.0,117
340 - Kahandolpada,Zilla parishad primary School Kahandolpada East Side Room No,117
341 - Khirdi,Zilla parishad primary School Khirdi West Side Room No.01,117
