PS No & Name,Address,Constituency Number
1 - Maldoli,Z. P. Primary Kendriy Marathi School Maldoli 1 (Room No.1),266
2 - Maladoli,Z. P. Primary Urdu School Maladoli Room No.1,266
3 - Karambavane,Z.P. Adrsha School Karambavane 1 Room No.1,266
4 - Ketki,Z.P. Primary Marathi School Ketki No. 1 Room No. 1,266
5 - Bhile,Z.P. Primary School Bhile Room No.1,266
6 - Majarekashi Chiplun,Z. P. Urdu School Majarekashi South side Room No. 1,266
7 - Parshuram,Z.P. Primary. School Parshuram No. 1 Room No. 1,266
8 - Pedhe Pankarwadi,Z.P. Primary. School. Pedhe (Panakaravadi ) Room No.1,266
9 - Pedhe Koshtewadi,Z.P. Primary. School. Pedhe (Koshtewadi ) Room No. 1,266
10 - Valope,Z.P. Primary Kendriy School Valope No.1 Room No.1,266
11 - Valope,Z.P. Primary Kendriy School Valope No.1 Room No.2,266
12 - Khandant,Purn Primary School. Khandant (punarvasan )navin Kolakevadi No. 1 Room No.1,266
13 - Pali,Z.P. Purn Primary School Khandatapali Room no.1,266
14 - Nirabade,Z.P. Purn Primary School Nirabade No. 1 Room No.1,266
15 - Moravane Bu.,Z.P. Purn Primary School Morvane No. 1 Room No.1,266
16 - Moravane,Z.P. Purn Primary Adrsha Kendra School. Morvane No. 2 Moravane Room No.1,266
17 - Akale,Z.P. Primary School. Akale No. 1 Room No.1,266
18 - Tivare,Z.P.Purn Primary School Tivare No. 1 (Gavathan) New Building Room No.1,266
19 - Tivare,Z.P. Primary School Tivare No. 2 Gangechivadi Kholi No.1,266
20 - Riktoli,Z.P.Purn Primary School Riktoli (deulavadi ) No.1 Room No.1,266
21 - Tivadi,Z.P. Purn Primary School. Tivadi no.1 (Ralevadi ) Room No.1,266
22 - Kadavad,Z.P. Primary School Kadavad No. 1 Room No.1,266
23 - Valoti,Z.P. Primary School. Valoti No. 1 southside Room No.1,266
24 - Dalavatane,Z.P. Purn Primary. School. Dalavatane No. 1 Room No.1,266
25 - Dalavatane,Purn Primary Marathi School Dalavatane No.1 Room No.2,266
26 - Kalambaste,Z.P. Purn Primary Adrsha School. Kalambaste Room No. 1,266
27 - Kalambaste,Z.P. Purn Primary Adrsha School. Kalambaste Room No. 2,266
28 - (Uktad ) Chiplun,Z.P. Purn Primary M. Vidyalay Uktad Chiplun No.1 Room No.1,266
29 - Pethamap Chiplun,Z.P. Marathi School. Pethamap Room No.1 (Southside Room),266
30 - Khend Chowki Chiplun,Z.P. Urdu School Pethamap Room No.6 Northside Room,266
31 - Pethmap Chiplun Khend Chowki,Z.P. Urdu Pethamap School (Notrhside Room No. 5),266
32 - Pethmap Chiplun Khend Chowki,Z.P. Urdu Pethamap School (Office Room),266
33 - Govalakot Chiplun,Khadeeja English Medium School Govalakot (West side Room No. 1),266
34 - Govalakot Chiplun,Khadeeja English Medium School Govalakot (West side Room No.2 ),266
35 - Govalakot Chiplun,Khadeeja English Medium School Govalakot (East side Room No.1 ),266
36 - Govalakot Chiplun,Z.P.Kendriy Primary School Govalkot Urdu School Govalakot Eastside Room No.4,266
37 - (Govalakot ) Chiplun,Z.P. Jeevan Shikshan Urdu Pu Primary School Govalakot Chiplun No.1 Room No.1,266
38 - Muradapur Chiplun,Chiplun Education Society Maharashtra High School Eastside Room 1,266
39 - Muradapur Chiplun,Chiplun Education Society Maharashtra High School Eastside Room No. 3,266
40 - Desai Mohalla Chiplun,Chiplun Education Society Maharashtra High School Westside Room 1,266
41 - Vadanaka Chiplun,Mahila Mandal Chiplun Room No.1,266
42 - Kanya Shala Chiplun,Kanya School Chiplun Eastside Room 1,266
43 - Vadanaka Chiplun,Kanya Shala Chiplun Westside Room,266
44 - Chinchanaka Chiplun,Kanya shala Chiplun Room No. 4,266
45 - Markandi Chiplun,Uunayated English School Chiplun Navin Shishuvihar Gyandeep Eastside Room No. 3,266
46 - Markandi Chiplun,Uunayated English School Chiplun Navin Shishuvihar Gyandeep Eastside Room No. 4,266
47 - Markandi Chiplun,Uunayated English School Chiplun Navin Shishuvihar Gyandeep Eastside Room No. 5,266
48 - Pag Chiplun,G. Panchayatasamiti. Bandhakam Vibhaag Panchayat. Samiti Karya. Chiplun Room No.1,266
49 - Pag Chiplun,Z.P. Pu. Primary School Pag Mulanchi Chiplun Eastside Room,266
50 - Pag Chiplun,Z.P. Purn Primary School Pag Mulanchi Chiplun West Room,266
51 - Pag Chiplun,Z.P. Purn Primarya Marathi School Pag Mulanchi Chiplun Southside Room,266
52 - Pag Chiplun,Z.P. Purn Primarya Marathi School Pag Mulanchi Chiplun North side Room no.1,266
53 - Khend Chiplun,Z.P. Kendra School Khend Mulanchi Southside Room,266
54 - Khend Chiplun,Z.P. Kendra School Khend Mulanchi Northside Room,266
55 - Khend Chiplun,Z.P. Kendra School Khend Mulanchi Westside Room,266
56 - Khend Marathi School Chiplun,Ratna. Z.P. purn Primary Urdu School Mapari Mohalla Chiplun Eastside Room,266
57 - Bhatkar Mohalla Chiplun,Ratna. Z.P. purn Primary Urdu School Mapari Mohalla Chiplun Westside Room,266
58 - Bazaar Peth Chiplun,Talathi Karyalay Chiplun,266
59 - Chiplun Upanagar Bahaddur Shaikh,Vashishthi Krushi Sahkari Sanstha Kavilatali Chiplun (Westside Room),266
60 - Chiplun Upanagar Bahaddur Shaikh,Vashishthi Krushi Sahkari Sanstha Kavilatali Chiplun (Noth side Room ),266
61 - Kavilatali Vangade Mohalla Chiplun,Laxmi Bai Marutiray Bandal High School Inglish Midiyam Ground Floor Room No. 1,266
62 - Kavilatali Chiplun,Laxmi Bai Marutiray Bandal High School English Medium Ground Floor Room No. 4,266
63 - Kavilatali Chiplun,Laxmi Bai Marutiray Bandal High School English Medium Ground Floor Room No. 5,266
64 - Bahaddurashekh Chiplun,Z.P. Purn Primary. Marathi School Ozaravadi Chiplun ( Nothside Room ),266
65 - Bahaddurashekh Chiplun,Z.P. purn Primary. Marathi School Ozaravadi Chiplun (Westside room ),266
66 - Kavilatali Chiplun Parshuram Nagar,Navakokan Education Society Dr. D. B. J. Mahavidyalay Chiplun Room No 2,266
67 - Kavilatali Chiplun,Navakokan Education Society Dr. D. B. J. Mahavidyalay Chiplun Room No 3,266
68 - Kaluste Budruk,Pu. Pra. Z.P. Marathi School Kaluste Budruk Room No.1,266
69 - Kaluste Khurd,Z.P. Adrasha Urdu Primary School Kaluste Kanya Room No.1,266
70 - Kaluste Khurd,Jeevan Shikshan School Kaluste Urdu (mulanchi ) Room No.1,266
71 - Dhameli Kond,Gramapanchayat Offfice Dhameli,266
72 - Bivali,Z.P. Primary. Marathi. School. Bivali Room No.1,266
73 - Kondhe,PurnaPrimary. Z.P. Marathi. School. Kondhe Room No.1,266
74 - Kondhe,PurnaPrimary. Z.P. Marathi. School. Kondhe Room No.2,266
75 - Mirajoli,Z.P.purn Primary. Marathi School. Mirajoli (Suothside Room ),266
76 - Mirajoli,Z.P.purn Primary. Marathi School. Mirajoli (Northside Room),266
77 - Ravtale,Z.P. Marathi. School. Ravtale Room No.1,266
78 - Ravtale,Z.P. Purna Primary School Dhamanavane No. 1 Room No. 1,266
79 - Kherdi,Z.P. School Kherdi (deulavadi ) Room No.1,266
80 - Kherdi,Z.P.purn prathmik Adrsha kendriy School Kherdi No.1 (west side Room),266
81 - Kherdi,Z.P.purn prathmik Adrsha kendriy School Kherdi No.1 (Suothside Room),266
82 - Kherdi,Z.P.purn prathmik Adrsha kendriy School Kherdi Eastside Room 1,266
83 - Kherdi,Z.P.purn prathmik Adrsha kendriy School Kherdi westside room no.1,266
84 - Kherdi,Z.P.purn prathmik Adrsha kendriy School Kherdi No.1 westside room no.2,266
85 - Kherdi,Z.P. purn Primary School Kherdi (shigavanavadi ) Kholi 1,266
86 - Kherdi,Z.P. Marathi School Kherdi (shigavanavadi ) Kholi 2,266
87 - Kherdi,Z.P.purn Primary. Urdu School. Kherdi (Suothside Room ),266
88 - Kherdi,Z.P.purn Primary. Urdu School. Kherdi (uttarekadil Kholi ),266
89 - Sati Chinchaghari,New Inglish School Kherdi Chinchaghari (sati ) Room No.1,266
90 - Chinchaghari,Z.P. purn Primary Marathi School Chinchaghari Room No.1,266
91 - Pimpali Khurd,Z.P. purn Primary Adarsh School Pimpalikhurd (Northside Room ),266
92 - Pimpali Khurd,Z.P. purn Primary Adarsh Marathi School Pimpalikhurd (Eastside Room ),266
93 - Khadapoli,Z.P. purn Primary School Khadapoli Room No.1,266
94 - Khadapoli,Z.P. purn Primary School Khadapoli Room No.2,266
95 - Gane,Z.P. School. Gane Room No.1,266
96 - Kalakavane,Z.P. KendriySchool. Kalakavane No. 1 Room No.1,266
97 - Radhanagar,Z.P.purn Primary School Nandivase Radhanagar Room No.1,266
98 - Nandivase Swayamdev,Z.P.Purn Primary School Swayamdev Room No.1,266
99 - Ganeshapur (talevadi ),Z.P.Kendriy School Nandivase No. 1 Room No.1,266
100 - Ovali,Z.P.Purn Primary School Ovali No. 1 Room no.1,266
101 - Pedhambe,Z.P. Adrsha School Pedhambe No. 1 Room No.1,266
102 - Pedhambe,Z.P. Rantangir Primary School No. 2 Pedhambe (Bharade )Room No.1,266
103 - Pimpali Bu.,Z.P.purn Primary. Marathi. School. Pimpali Bu. Room No.1,266
104 - Kanhe,Z.P. Kendriy School Kanhe Marathi Old Building,266
105 - Kanhe,Z.P. Kendriy Marathi School Kanhe New Building,266
106 - Adare,Z. P. Primary School. Adare No. 1 Room No.1,266
107 - Adare,Z.P. Primary School Adare No. 2 Room No.1,266
108 - Terav,Z.P. purn Primary School Terav No. 1 Northside Room,266
109 - Terav,Z.P. purn Primary School Terav No. 1 Suothside Room,266
110 - Terav Bu.,Z.P. primary School Terav No. 2 Room No.1,266
111 - Vehele,Z.P. purn Primary School. Vehele Pitalevadi No. 1 (navin Imarat ) Room No.1,266
112 - Vehele,Z.P. Primary School Vehele No. 2 Room No. 2,266
113 - Nagave,Karamanuk Kendra Alore (Eastside Room No. 1 ),266
114 - Nagave,Karamanuk Kendra Alore (Eastside Room No. 2 ),266
115 - Kolakevadi,Z.P. Ratnagiri Adarsh Kendra School Kolakevadi No.1 (Westside Room No. 1),266
116 - Kolakevadi,Adarsh KendraSchool Kolkewadi (Westside Room No. 2),266
117 - Kolakevadi,Adarsh KendraSchool Kolkewadi (Eastside Room No. 1),266
118 - Khond fansavane,Z.P. Primary School Khondfansavane Room No.1,266
119 - Kumbharli,Z.P.School Kumbharli No. 1 (Room No. 1 ),266
120 - Kumbharli,Z.P.School Kumbharli No. 1 (Room No. 2 ),266
121 - Alore,Anganwadi Kendra Alore Deulwadi,266
122 - Alore,Z.P. Adarsh School Alore Colony Room No.3,266
123 - Alore,Z.P. Adarsh School Alore Colony Room No.2,266
124 - Alore,Z.P. Adarsh School Alore Colony East side Room No.1,266
125 - Mundhe T. Chiplun,Z.P.purn Primary Adarsh School Mundhe T. Chiplun Room No.1,266
126 - Anari,Z.P. purn Primary Adrsha School Anari Room No.1,266
127 - Savarde Khu.,Ratnagiri Z.P. Primary Urdu School Savarde Khu. Room No.1,266
128 - Kondamala,Z.P. purn Primary. Marathi School Kondamala Room No. 2 Purv/pashchim Imarat,266
129 - Kondamala,Z.P. purn Primary. Marathi School Kondamala South/North room no 3,266
130 - Savarde Colony,Z.P. Primary School Savarde Colony Room No.1,266
131 - Savarde,Sahyadri Shikshan Sanstha New English School Savarde Room No.1,266
132 - Savarde,New English School Savarda Farmasi College Savarde Room no.1,266
133 - Savarde,Zilla Parishad Purna Prathamic School Sawarde Kumbharwadi Room No.1,266
134 - Kudap,Kalikadevi Vidyamandir Primary Z.P. Marathi School No. 1 Room No.1,266
135 - Talasar,Z.P. Purn Primary Kendriy School Talasar Room No.1,266
136 - Talasar,Z.P. Primary. School Talasar No. 2 Shirkevadi Room No.1,266
137 - Shiragaon,Z.P. purn primary Kendra Shiragaon School No. 1 Room No.1,266
138 - Shiragaon,Z.P. purn primary Kendra Shiragaon School No. 1 Room No.2,266
139 - Shiragaon,Shirgaon Secondary And Higher Secondary High School Shirgaon Room No. 1,266
140 - Shiragaon,Shirgaon Secondary And Higher Secondary High School Shirgaon Room No. 2,266
141 - Pophali Bu. (Ankhusakhanagar ),Z.P. Primary Urdu School. Pophali No. 1 South sinde Room No.1 Akhushkhan Nagar,266
142 - Pophali Bu. (Ankhusakhanagar ),Z.P. Primary School Pophali Marathi (Pawarwadi) Room no.1,266
143 - Phophali,Anganwadi Pophali,266
144 - Phophali,ZP purn Primary Adrsha School Pophali Hodewadi Room No.4,266
145 - Pophali,ZP purn Primary Adrsha School Pophali Hodewadi Room No.2,266
146 - Mundhe T. Savarda,Z.P.purn Primary. School. Mundhe Tarf Savarda Room no.1,266
147 - Deravan,Z.P. purn Primary. School Deravan No. 1 Room No.1,266
148 - Deravan,Z.P. purn Primary. School Deravan No. 1 Room No.2,266
149 - Savarde Kasaravadi,Z.P. purn Primarya School. Savarde Kasaravadi Room No.1,266
150 - Agave,Z.P.purn Primary School. Agave No. 1 Room No.1,266
151 - Agave,Z.P.Purna Prathamic Marathi School Agave No.1 R/No. 2,266
152 - Mandaki,Z.P. School Mandaki No.1 Room No. 1,266
153 - Mandaki,Z.P. School Mandaki No.1 Room No. 2,266
154 - Mandaki Khurd,Z.P. School Mandaki Khurd Room No.1,266
155 - Asurde,Z.P. School. Asurde Boudh wadi,266
156 - Asurde,Z.P. purn Primary. School. Asurde No. 1 Room No.1,266
157 - Ambatakhol,Z.P. Primary School Ambatakhol No. 1 Suothside Room,266
158 - Hadakani,Z.P. Pu. Primary School. Hadakani Room No.1,266
159 - Kosabi,Purn Primary. Z.P. School Kosabi Room No.1,266
160 - Furus,Sahyadri Shikshan Sanstha New English School Kosabi Furus Room No.1,266
161 - Durgavadi,Z.P. Ratna. Primary School. Durgavadi Prabhukond Room No.1,266
162 - Durgavadi Khurd,Z.P. Ratna. Primary. Marathi School Durgavadi No. 1 Room No.1,266
163 - Talavade,Z.P.purn primary School. Talavade Room No.1,266
164 - Kutare,Z.P. Marathi School Kutare No. 1 Khalachipeth Room No.1,266
165 - Kutare,Z.P. Marathi School Kutare No. 6 Khairwadi,266
166 - Yegaon,Z.P. purn Primary School Yegaon Room No.1,266
167 - Nandgaon,Z.P. purn Primary School. Nandaganv No. 1 Eastside Room,266
168 - Nandgaon,Z.P. Primary Adarsh School Nandgaon No. 2 Room No. 1,266
169 - Kushivade,Z.P.purn primary School. Kushivade No. 1 Room No.1,266
170 - Kushivade,Z.P.purn Primary School Kushivade No 2 Shigvanwadi Room No.1,266
171 - Shirambe,Z. P. Purn. Prathamik. Shala Shirambe,266
172 - Purye T. Savarda,Z. P. Shala Purye T. Savarda No. 2 Bramhanavadi,266
173 - Kalambushi,Shri. Shivaji Vidhya Mandir Kalambushi No. 1,266
174 - Kondivare,Z. P. Prathamik. Shala Kondivare Urdu,266
175 - Aravali,Z. P. Prathamik. Shala Aravali No. 1,266
176 - Aravali,Z. P. Primary School Aravali No.3,266
177 - Muradav,Z. P. Purn. Prathamik. Marathi Shala Muradav No. 1,266
178 - Muradav,Z. P. Shala Muradav No. 2,266
179 - Kumbharakhani Bu.,Jeevan Shikshan Shala Kumbharakhani Bu. No. 1,266
180 - Kuchambe,Z. P. Purn. Prathamik. Shala Kuchambe No. 1,266
181 - Rajivali,Z. P. Purn. Prathamik Shala No. 1 Rajivali,266
182 - Ratambi,Z. P. Prathamik Shala Ratambi,266
183 - Pachambe,Z. P. Ratnagiri Purn. Prathamik. Shala Pachambe No. 1,266
184 - Shenavade,Nirmal Gru. Gra. Panchayat Karyalay Shenavade Rangav,266
185 - Rangav,Jilha Parishad Adrash Shala Rangav,266
186 - Chikhali,Z. P. Purn. Prathamik. Marathi Shala Chikhali No. 1,266
187 - Chikhali,Z.P. Purn marathi school buddha wadi chikhli,266
188 - Vikasanagar,Z. P. Prathamik. Shala Kadavai No.4 Dakshinekadil Kholi No.2,266
189 - Kadavai,Z. P. Prathamik. Shala Kadavai No. 1 Juni Imarat,266
190 - Kadavai,Z. P. Adarsh Kendra Shala Kadavai Urdu,266
191 - Kadavai,Purn. Prathamik. Shala Kadavai No. 1,266
192 - Kadavai,Z. P. Prathamik. Shala Kinjalakaravadi V Dhulapavadi,266
193 - Shinde Amberi,Z. P. Shala Shinde Amberi,266
194 - Ambav Ponkshe,Z. P. Purn. Prathamik. Marathi Shala Ambav Ponkshe Devarahatitil Jage Madhye,266
195 - Ambav Ponkshe,Z.P purn prathamik shala no-1 room no-2 Ambav ponkshe,266
196 - Burambad,Z. P. Prathamik . Shala Burambad No. 1 Kholi No.2,266
197 - Burambad,Parshuram Bal Vidyalay Burambad No. 2 Shala No. 2,266
198 - Kase,Z. P. Prathamik. Marathi Shala Kase Kr. 2,266
199 - Naraduve,Z. P. Marathi Shala Naraduve No. 1,266
200 - Pedhambe,Z. P. Marathi Shala Pedhambe No. 2,266
201 - Karajuve,Z. P. Adarsh Shala Karajuve No. 2,266
202 - Karajuve,Z. P. Adarsh Shala Karajuve No. 4,266
203 - Karajuve,Z. P. Adarsh Shala Karajuve No. 3,266
204 - Dhamapur T. Sangameshwar,Z. P. Pra. Kendra Shala Dhamapur Tarfe Sangameshwar No. 1,266
205 - Dhamapur T. Sangameshwar,Z.P. Marathi School Dhamapur tarfe Sangameshwr Shala Number .6,266
206 - Dhamapur T. Sangameshwar,Z. P. Adarsh Shala No. 3,266
207 - Dhamapur T. Sangameshwar,Z.P.Adarsh Shala Dhamapur No.8 Dakshinekadil Kholi No.2,266
208 - Dhamapur T. Sangameshwar,Z. P. Adarsh Shala Dhamapur No. 4,266
209 - Mavlange,Z. P. Adarsh Shala Mavlange,266
210 - Makhjan,Z. P. Marathi Adarsh Shala Makhajan,266
211 - Makhjan,Z. P. Marathi Adarsh Shala Makhajan,266
212 - Sarand,Makhajan Inglish School,266
213 - Harekarvadi,Z. P. Shala Harekaravadi Kholi No.1,266
214 - Tural,Z. P. Purn Prathamik. Shala Tural No. 1,266
215 - Tural,Z. P. Kendriy Shala Tural No. 2,266
216 - Rajvadi,Z. P. Purn. Prathamik. Marathi Shala Rajvadi Bramhanavadi,266
217 - Shembavane,Z. P. Pu.Primary Adarsh School Shembavane Mhadevadi North Side Room No.2,266
218 - Masarang,Z. P. Shivaji Vidhya Mandir Masarang,266
219 - Tambedi,Z. P. Purn. Prathamik. Shala No. 1 Tambedi,266
220 - Nivali,Z. P. Purn. Prathamik. Shala Nivali,266
221 - Shrungarapur,Z. P. Ratna. Purn. Shala Shrungarapur,266
222 - Nayari,Z. P. Purn. Prathamik. Marathi Shala Nayari Mohalla,266
223 - Karabhatale,Z. P. Marathi Shala Karabhatale,266
224 - Anaderi,Ratnagiri Z. P. Anaderi Shala,266
225 - Antravali,Z. P. Purn. Prathamik. Shala Marathi Antravali,266
226 - Fanasavane,Gramapanchayat Karyalay Fanasavane,266
227 - Fanasavane,Z. P. Purn. Prathamik. Shala Fanasavane No. 1 Guravavadi Pahili Kholi,266
228 - Dhamani,Z. P. Purn. Prathamik. Adarsh Kendriy Shala Dhamani No. 1 New Building,266
229 - Dhamani,Z. P. Marathi Shala Dhamani Badadavadi,266
230 - Golavali,Z. P. Marathi Shala Jambhulwadi,266
231 - Golavali,Z. P. Marathishala Kinjalevadi,266
232 - Golavali,Z. P. Shala Raulavadi,266
233 - Kumbharakhani Khurd,Z. P. Prathamik. Shala Kumbharakhani Khurd Gaulavadi Kr. 2,266
234 - Ambed Khurd,Z. P. Shala Ambed Khurd No. 1 Purvekadil Trisari Kholi,266
235 - Maladevadi,Z. P. Purn. Prathamik. Shala Kalambaste Maladevadi Kr. 1,266
236 - Umare,Z. P. Prathamik. Shala Baitavadi Pashchimekadil Pahili Kholi,266
237 - Tivare Ghe. Prachitagad,Z. P. Marathi Shala Tivare Ghera Prachitagad,266
238 - Devole Ghe. Prachitagad,Z. P. Marathi Shala Devole Ghe. Prachitagad,266
239 - Kulye,Z. P. Shala Kulye Dekshinekadil Pahili Kholi,266
240 - Vashi T. Sangameshwar,Z. P. Purn. Prathamik. Kendra Shala Vashi T. Sangameshwar Juni Imarat,266
241 - Bhim Nagar,Z. P. Marathi Shala Kalambaste Baudhdavadi No. 3,266
242 - Bhim Nagar,Z.P.Marathi School Kalbaste Bauddhawadi Number .2,266
243 - Kalambaste,Z. P. Marathi Shala No. 1 Kalambaste,266
244 - Kasaba Sangameshwar,Z. P. Ratna. Raja Chhatrapati Sambhaji Vidyalay Sangameshwar No. 1 Kasaba Purvekadil Kholi No.1,266
245 - Kasaba Sangameshwar,Z. P. Ratna. Raja Chhatrapati Sambhaji Vidyalay Sangameshwar No. 1 Kasaba Pashchimekadil Kholi No.2,266
246 - Kasaba Sangameshwar,New Inglish School Kasaba,266
247 - Kond Ambed,"Z.P.Purn Prathamik Shala,Kond Ambed",266
248 - Kasaba Sangmeshwar,Ratna.Z.P.Urdu Shala Kasaba Sangmeshwar,266
249 - Kasaba Sangmeshwar,Ratna.Z.P.Urdu Shala Kasaba Sangmeshwar,266
250 - Kond Asurde,Adarsh Z. P. Shala Kond Asurde No. 1 Purvekadil Kholi,266
251 - Jambhulavadi,Z. P. Shala Jambhulavadi,266
252 - Asurde,Z. P. Marathi Shala Asurde No. 2,266
253 - Sakhalakond,Z. P. Marathi Shala Sakhalakond,266
254 - Ramapeth,Z. P. Prathamik. Kendra Shala Sangameshwar No. 2 Ramapeth Juni Imarat,266
255 - Terye,Ratnagiri Z. P. Shikshan Khate Terrye No. 1,266
256 - Terye,Z. P. Prathamik . Shala Terrye No. 2,266
257 - Muchari,Z. P. Marathi Shala Muchari Varangalavadi Kond,266
258 - Muchari,Z. P. Marathi Shala Nutan Juni Imarat,266
259 - Muchari,Z. P. Marathi Shala Muchari Ghotalavadi,266
260 - Sonavade,Z. P. Prathamik. Vidayamandir Sonavade Navi Imarat,266
261 - Borasut,Purn. Prathamik. Marathi Shala Borasut,266
262 - Sayale,Z. P. Ratna. Adarsh Kendra Shala Sayale Purvekadil Kholi No.1,266
263 - Katavali,Z. P. Purn. Prathamik. Shala Katavali No. 1 Purvekadil Hall,266
264 - Katavali,Shala Katavali No. 2 Padayevadi,266
265 - Fanasavale,Z. P. Purn. Prathamik. Shala Fanasavale,266
266 - Kundi,Z.P. Adarsh Uchha Pra. Shala Kundi,266
267 - Belari Budruk,Purn. Prathamik. Marathi Shala Belari Bu. Kadamavadi,266
268 - Talavade Tarfe Devarukh,Z. P. Purn. Prathamik. Shala Talavade T. Devarukh,266
269 - Ozare Khurd,Z. P. Prathamik. Marathi Shala Ozare Khu.,266
270 - Vighravali,Z. P. Shala Vighravali Khalachivadi,266
271 - Kosumb,Ratna Z. P. Prathamik. Shala Kosumb No. 1,266
272 - Kosumb,Z.P. Adarsh Shala Karambele Kosumb East Side Room No.1,266
273 - Karambelai Tarfe Sangameshwar,Z. P. Marathi Shala Karambele T. Sangameshwar,266
274 - Shivane,Z. P. Ratna. Shivane Kr. 1,266
275 - Ujagaon Shevaravadi,Z. P. Marathi Shala Ujaganv No. 2,266
276 - Ujagaon,Z. P. Purn. Prathamik. Shala Ujaganv No. 1,266
277 - Ambavali,Z.P. Primary. Marathi. School. No. 1,266
278 - Nandlaj,Z. P. Purn. Prathamik. Marathi. Shala. Nandalaj,266
279 - Tamhane,Z. P. Marathi Shala Tamhane,266
280 - Kudavali,Z. P. Shala Kudavali No. 1,266
281 - Sadavali,Z. P. Shala Sadavali,266
282 - Sadavali,Z. P. Shala Sadavali,266
283 - Sadavali,Z. P. Shala No.2 Sadavali Sahayadrinagar Kholi No.3,266
284 - Devrukh,Z.P.Kendra Shala Devrukh No. 1,266
285 - Devrukh,Z.P.Kendra Shala Devrukh No. 1,266
286 - Devrukh,Chhatrapati Shivaji Z. P. Vidyamandir Devarukh No. 4 Kholi no.3,266
287 - Devrukh,New Inglish School Guruwarya Kakasaheb Sapre Vidnyan Kanishth Mahavidyalay Devarukh,266
288 - Devrukh,Chhatrapati Shivaji Vidyamandir Devarukh No.4 Kholi No.1 purvekadil,266
289 - Devrukh,"Z.P.Purn Prathamik Shala, Devrukh no.03 Dakshinekadil kholi",266
290 - Devrukh,"Z.P.Purn Prathamik Shala, Devrukh no.03 Dakshinekadil kholi no.5",266
291 - Devrukh,Z.P. Prathmik shala Devrukh no.2,266
292 - Devrukh,Ratnagiri Zilla Parishad pre primary School Devrukh No.2(west side room no.2),266
293 - Devarukh,Z.P. School Devrukh Bagwadi,266
294 - Harapuden,Z.P.Purn Prathmik shala Harpude No.1 west side room no.1,266
295 - Nive Khurd,Adarsh Kendra Shala Nive khurd Parabwadi,266
296 - Nigudvadi,Z.P. Adarsh Prathmik shala Nigudwadi North side kholi,266
297 - Bamanoli,Z.P. Prathmik shala Bamnoli No.1 Kholi No.1,266
298 - Maral,Z.P.Kendra Shala Maral,266
299 - Sonaravadi,Z.P.Shala Sonarwadi Kholi No.1,266
300 - Angavali,Z.P.Marathi Shala Angwali old building,266
301 - Hativ,Z.P.Marathi Shala Hativ NO 1 Kholi No.1,266
302 - Hativ,Z.P.Marathi Shala Hativ Gothane Punarvasan,266
303 - Hativ,Z.P Marathi School no 1 Kholi No-2,266
304 - Muradpur,Z. P. Marathi Shala Muradapur No. 1,266
305 - Muradpur,Z. P. Marathi Shala No. 2 Purvekadil Pahili Kholi,266
306 - Devrukh Parsharamavadi,Z.P.Purn Prathmik Shala Devrukh Parshramwadi Kholi no.1,266
307 - Patangaon,Z. P. Purn. Prathamik. Nutan Vidyamandir Pantaganv Kholi No. 2,266
308 - Pur,Z. P. Purn. Prathamik. Shala Pur,266
309 - Pur,Z. P. Purn. Prathamik. Shala Kirdadi,266
310 - Kondkadamrao,Z. P. Jivan Shikshan Shala Kondakadamarav Pahili Kholi,266
311 - Kondbhujbalrao,Grampanchayat Karyalaya Kondakadamarav-Kondbhujabalrao Ground Floar Gala Room No.1,266
312 - Sangave,Z. P. Purn. Prathamik. Shala Sangave,266
313 - Dhamapur Tarfe Devarukh,Z. P. Marathi Shala Dhamapur T. Devarukh Kholi no 1,266
314 - Ambavali Musalamanavadi,Z. P. Urdu shala Ambavali Kholi no 3,266
315 - Fansat,Z.P. Prathamik Shala fansat Kholi Kramank.1,266
316 - Ghodavali,Purn. Prathamik. Shala Vidyalay Ghodavali,266
317 - Pangari,Z. P. Purn Prathamik. Shala Pangari No. 2,266
318 - Pangari,Z. P. Ratna. Prathamik. Shala Pangari No. 1,266
319 - Tulasani,Z. P. Purn. Prathamik. Kendriy Shala Tulasani No. 1 Kholi no 3,266
320 - Agarevadi,Lok Vidayalay Tulasani,266
321 - Nive Budruk,Z. P. Purn. Prathamik. Shala Nive Bu. Kr. 1 Dakdhinekadil Imarat Purvekadil Kholi,266
322 - Nive Budruk,Z. P. Purn. Prathamik. Shala Nive Bu. Kr. 1 Dakshinekadil Imarat No.1 Purvekadil Kholi,266
323 - Karli,Z. P. Purn. Prathamik. Shala Karli No. 1,266
324 - Vashi Tarfe Devarukh,Z. P. Kendra Shala Vashi T. Devarukh,266
325 - Vanzole,Z. P. Purn. Prathamik. Shala Vanzole Khurd Gavaliwadi Purvekadil Dusari Kholi,266
326 - Kasarakolavan,Z. P. Shala Kasarakolavan Anganwadi Imarat,266
327 - Bondaye,Purn. Prathamik. Shala Bondaye Pachimekadil Kholi NO.2,266
328 - Nivadhe,Z. P. Marathi Shala Nivadhe,266
329 - Khadikolavan,Z.P.Purn Prathmik Marathi Shala Khadikolavan Kholi no.2,266
330 - Ozare Bn.,Purn. Prathamik. Marathi Sha. Ozare Bu. Kholi no.1 Holicha Mach,266
331 - Dakhin,Z. P.Marathi Shala Dakhin Kholi No.1,266
332 - Vanzole,Z.P.Kendriy Shala Bhoiwadi uttarekadil Kholi No. 1,266
333 - Morde,Purn. Prathamik. Marathi Shala. Morde No. 1,266
334 - Karambele Tarfe Devale,Z. P. Pu. Pra. Shala Karambele T. Devale,266
335 - Kiraduve,Sharda Vidyamandir Kiraduve,266
336 - Vanyagane,Z.P. Pu. Pra. Shala Vayangane No. 1,266
