PS No & Name,Address,Constituency Number
1 - Vijaydurg,Z.P Purna Prathmik Shala No.1 (West) ),268
2 - Vijaydurg,Z.P Purna Prathmik Shala No. 1 (East ),268
3 - Rameshwar,Z.P Prathmik Shala Rameshwar,268
4 - Rameshwar Girye Kolwadi,Z.P Prathmik Shala Rameshwar Kolwadi,268
5 - Girye,Z.P Purna Prathmik Kendra Shala No.1 (South ),268
6 - Girye,Z.P Purna Prathmik Kendra Shala No. 1(North),268
7 - Bandegaon,Bhausaheb Lokegaonkar Vidyalay Girye,268
8 - Mohulgaon,"Z.P Prathamik shala Tirlot, Mohulgaon",268
9 - Thakurwadi,Z.P Prathamik Shala Thakurwadi Urdu,268
10 - Tirlot,Z.P Purn Prathamik Shala Tirlot Marathi (North),268
11 - Tirlot,Z.P Purn Prathamik Shala Tirlot Marathi (South),268
12 - Tirlot,Z.P Purn Prathamik Shala Tirlot Amberi,268
13 - Kasba Waghotan,Z.P Purn Prathamik Shala Kasba Waghotan,268
14 - Soundale ( Boulwadi ),Z.P Prathamik Shala Soundale (Boulwadi ),268
15 - Soundale,Z.P Prathamik Shala Soundale Gavthan.,268
16 - Soundale (Heldhewadi ),Z.PPrathamik Shala Soundale Heldewadi,268
17 - Padel,Zilla Parishad Prathamik Kendrashala Padel No. 1,268
18 - Padel,Shriram Madhyamik Vidhyamandir Padel,268
19 - Padel,Z.P. Prathamik Shala Padel Gavkarwadi,268
20 - Hurshi,Z.P. Purn Prathamik Shala Pural-Hurshi,268
21 - Kalambai,Z.P Purn Prathamik Shala Pural-Kalambai,268
22 - Pural,Purn Prathamik shala Pural Kasaba,268
23 - Phanase,Purn Prathamik Shala Phanase,268
24 - Wada,Anant Krushna Kelkar High school Wada (East),268
25 - Wada,Anant Krushna Kelkar High school Wade (West),268
26 - Nadan,Z.P Purna Prathamik shala Nadan No.1,268
27 - Nadan,Gram Panchayat Karyalay Nadan,268
28 - Malegaon,Purn Prathamik Shala Malegaon Zarkarwadi,268
29 - Malegaon Veer Anbhavanewadi,Z.P. Purn Prathamik Shala Malegaon Anbhavnewadi,268
30 - Waghotan Sadewadi,Z.P Prathamik Shala Sade Waghotan,268
31 - Palekarwadi,Z.P.Purna Prathamik Shala Palekarwadi No.1,268
32 - Mutat,Z.P.Purna Prathamik Shala Mutat No. 1,268
33 - Mutat,Grampanchyat Karyalay Mutat,268
34 - Manche,Z.P Purn Prathamik Kendrashala Manche No.1,268
35 - Manche,Z.P Purn Prathamik Shala Manache Tari Vathar,268
36 - Pombhurle,Z.P. Purn Prathamik Kendrashala Pombhurle No.1 (East),268
37 - Pombhurle,Z.P Purn Prathamik Kendrashala Pombhurle No. 1 (West),268
38 - Malpewadi,Z.P Purn Prathamik Shala Malpe Marathi,268
39 - Dhalvali,Korle-Dhalvali Madhyamik Vidyalay,268
40 - Korle,Z.P.Prathamik Shala Korle No. 1,268
41 - Kunkavan,Z.P. Prun Prathamik Shala Kunkavan No. 1,268
42 - Undil,Z.P. Purn Prathamik Shala Undil No. 1,268
43 - Vitthaladevi,"Z.P Purna Prathamik Shala, Vithaladevi No. 1",268
44 - Phanasgaon,Z.P Purn Prathamik Shala Pandurang School Phanasgaon,268
45 - Phanasgaon,Marathi Shala Phanasgaon Pendurkarwadi,268
46 - Goval,Goval Z.P Shala Gavthan,268
47 - Patgaon,Z.P Prathamik Shala Patgaon No.1,268
48 - Somalewadi,Z. P Prathamik Shala Goval Somalewadi,268
49 - Pendhari,Z.P Prathamik Shala Pendhari,268
50 - Baparde,Z.P Purn Prathamik Kendrashala No .1 Baparde,268
51 - Juveswar,Purn Prathamik Shala Baparde Juviwadi,268
52 - Mond,Z.P Purn Prathamik Shala Mond No. 1,268
53 - Chinchawad,Z.P Purna Prathamik shala Mond Chinchawad,268
54 - Mondpar,Z.P Purn Prathamik Shala Mondpar No.2,268
55 - Veerwadi,Z.P Purn Prathamik Shala Nadan Veerwadi,268
56 - Wadatar,Z.P Sindhudurg Purn Prathamik shala Wada Tarwadi,268
57 - Padavane,Z.P Sindhudurg Purn Prathamik Shala Padavane,268
58 - Deogad,Z.P.Sindhudurg Purn Shala Deogad 1( East ),268
59 - Deogad,Z.P.Sindhudurg Purn Shala Deogad 1 ( West ),268
60 - Deogad Killa,Z.P.Sindhudurg Shala Deogad Killa,268
61 - Deogad,S .M.G Highschool Deogad (East ),268
62 - Deogad,S .M .G Highschool Deogad (West ),268
63 - Jamsande,Z .P Sindhudurg Purn Prathamik Shala Jamsande Katta,268
64 - Jamsande,Z. P. Sindhudurg Purn Prathamik Shala Jamsande Kavalewadi,268
65 - Jamsande,Z.P.Sindhudurg Purn Prathamik Shala Jamsande Tarwadi,268
66 - Jamsande,S. H. Kelkar College Arts & Commers College Devgad,268
67 - Jamsande,Shriram Moreshwar Gogate Vidhyamandir Jamsande ( East),268
68 - Jamsande,Shriram Moreshwar Gogate Vidhyamandir Jamsande ( South ),268
69 - Jamsande,Shriram Moreswar Gogate Vidhyamandir Jamsande (West),268
70 - Jamsande,Z. P Shala Jamsande Valkuwadi,268
71 - Jamsande,Z. P Shala Jamsande Khakashi,268
72 - Jamsande,Z.P Shala Jamsande Bhatwadi,268
73 - Jamsande,Z. P Shala Jamsande Taramumbari,268
74 - Tembavali,Purn Prathamik Shala Tembavli No.1,268
75 - Kalavi-Tembavali,Z. P Purn Prathamik Shala Kalavi,268
76 - Dabhole,Z.P.Shala Dabhole No1,268
77 - Dabhole,Z .P Shala Dabhole No.2,268
78 - Talavade,Z. P Purn Prathamik Kendra Shala Talavade No 1,268
79 - Pavnai,Z. P Purna Pra Shala Pavnai No1,268
80 - Wanivade,Z. P purn Prathamik Shala Waniwade No 2,268
81 - Gadhitamhane,Z. P. Prathamik Shala Teliwadi,268
82 - Rahateshwar,Z.P Purn Prathamik Shala Rahateshwar No.1,268
83 - Mahalunge,Z.P Shala Mahalunge No.1,268
84 - Waghivare,Z.P Purna Prathamik Shala Waghivare No1,268
85 - Burambawade,Grampanchayat Karyalay Burambawade,268
86 - Gavane,Z.P Purn Prathamik Shala Gavane,268
87 - Nad,Z.P Marathi Shala Nad No.1,268
88 - Shiravali,Z.P Purn Prathamik Shala Shiravali No. 1,268
89 - Ombal,Z.P Purn Prathamik Shala Ombal Gavthan Bouddhawadi,268
90 - Hadpid,Z.P Purn Prathamik Shala Hadpid Khalchiwadi,268
91 - Nimatwadi,Z.P.Purn Prathamik Shala Shirgaon Nimatwadi,268
92 - Shevare,Z.P Shala Shevare,268
93 - Shirgaon,Sindhudurg Z.P Purn Prathamik Shala Shirgaon Choukewadi,268
94 - Shirgaon,Shirgaon Highschool Shirgaon,268
95 - Shirgaon,Z.P Sindhudurg Prathamik Shala No .1 (EAST ),268
96 - Shirgaon,Z.P Sindhudurg Prathamik Shala No .1 (West ),268
97 - Valivande,Purn Prathamik Shala Valivande No.1,268
98 - Chandoshi,Z.P.Sindhudurg Marathi Shala Chandoshi,268
99 - Lingdal,Z.P Shala Vareri Lingdalwadi,268
100 - Talebazar,Z.P.Prathamik Shala Talebazar,268
101 - Vareri,Z. P Marathi Shala Vareri Gavthanwadi,268
102 - Vareri Palekarwadi,Z.P.prathamik Shala Vareri Palekarwadi,268
103 - Patthar,Z.P Purn Prathamik Shala Patthar,268
104 - Elaye,Z.P.Prathamik Shala Elaye Varandwadi,268
105 - Elaye,Z.P Sindhudurg Purn Prathamik Shala Elaye No .1,268
106 - Mithmumbari,Z.P Purn Prathamik Shala Mithmumbari No .1 ( East ),268
107 - Mithmumbari,Z.P. Purn Prathamik Shala Mithmumbari No .2 ( West ),268
108 - Kunkeshwar,Z.P.Purn Prathamik Kendra Shala Kunkeshwar No.1,268
109 - Katwaneshwar,Z.P Purn Prathamik Shala Kunkeshwar Katwan,268
110 - Katwan,Z.P Purn Prathamik Shala Katwan,268
111 - Mithbav,Z.P Prathamik Shala Mithbav Phatakwada,268
112 - Mithbav,Z.P Purn Prathamik kendrashala Mithbav No.1 (North ),268
113 - Mithbav,Z.P Purn Prathamik Kendra shala Mithbav No.1(South),268
114 - Dahibav,Z.P Prathamik Dahibav Prabhuwadi,268
115 - Dahibav,Z.P.Purn Prathamik Shala Dahibav No.1,268
116 - Kinjawade,Adarsh Vidhyamandir Kinjawade ( East),268
117 - Kinjawade,Adarsh Vidhyamandir Kinjawade (West),268
118 - Torsole,Z.P Purn Prathamik Shala Torsole,268
119 - Kotkamte,Z.P.Purn Prathamik Kendrashala Kotkamte No .1,268
120 - Dhoptewadi,Z P shala Shirgaon Padaghar,268
121 - Salashi,Z.P Purn Prathamik Kendrashala Salashi No.1,268
122 - Chafed,Z.P Purn Prathamik Shala Chafed No.1,268
123 - Kuvale,Z. P.Purn Prathamik Kuvale No. 1,268
124 - Rembvli,Purn Prathamik Shala Rembvli,268
125 - Are,Z.P Sindhudurg Purn Prathamik Shala Are Devichiwadi,268
126 - Are (Deobhati ),Z.P Shala Are Deobhati,268
127 - Khudi,Purn Prathamik Shala Khudi No.1,268
128 - Naringre,Z.P Sindhudurg Abasaheb Rane Vidhyamandir Naringre,268
129 - Tambaldeg,Shaskiy Matsyavyavasay Shala Tambaladeg,268
130 - Morve,Purn Prathamik Shala Hindale Morvewadi,268
131 - Hindale,Grampanchayat Karyalaya Hindale,268
132 - Hindale,Z.P.Purn Prathamik Shala Hindale Bhandarwadi,268
133 - Munge,Z.P.Prathamik shala Munage No.1,268
134 - Munage,Shri. Bhagavati. Highschool Munage,268
135 - Poyare,Z.P.Prathamik kendra shala Poyare Gangorameshwa,268
136 - Sandave,Z.P.Prathamik Shala Kuwale Sandave,268
137 - Tiravade Tarf Soundal,Vidhayamandir Tiravade Tarf Soundal,268
138 - Jambhavade,Kendrashala Vidhaya mandir Jambhavade No.1 Palandewdi,268
139 - Maunde,Balbhawan Vidhaya mandir Maunde,268
140 - Akhavne Guravwadi,Vidhya mandir Shala No.2 Akhavne Guravwadi,268
141 - Akhavne Bhom Nagapwadi Mangavli rehabilitation Gavthan,Vidhya mandir Akhavne No.1 Akhavne Bhom Nagapwadi Mangavli rehabilitation Gavthan,268
142 - Upale,Vidhayamandir Shala No.1 Upale,268
143 - Nerle,Zilla Parishad Vidhaya mandir Nerle No.1,268
144 - Mangavali,Vidhayamandir Mangavali No.1,268
145 - Mangavali,Mangavali Vidhayamandir Sansarwadi No.2,268
146 - Vengasar,Kendrashala Vengasar No.1,268
147 - Naniwade,Sarswati Vidhayamandir Naniwade,268
148 - Tithawali,Chhatrapati Shivaji Vidhayamandir Tithawali,268
149 - Digashi,Gangeshwar Vidhayamandir Digashi,268
150 - Kolape,Zilla Parishad Prathamik Shala Marathi Kolpe,268
151 - Umbarde,Seetaram Vidhayamandir Umbarde,268
152 - Mehabubanagar,Zilla Parishad Prathamik Urdu Shala Umbarde Mehabubanagar,268
153 - Umbarde,Yashawant Vidhayamandir Nayade Katkarwadi Umbarde,268
154 - Kumbharwadi,Sarswati Vidhayamandir Zilla Parishad Marathi Shala Kumbarwadi,268
155 - Het,Kendrashala Vidhayamandir Het No.1,268
156 - Ainari,Zilla Parishad Vidhayamandir Ainari,268
157 - Ringewadi,Vidhayamandir Ringewadi,268
158 - Bhuibawada,Gangeshwar Vidhayamandir Bhuibawada,268
159 - Tiravade Tarfe Kharepatan,Vidhayamandir Tiravade Tarfe Kharepatan,268
160 - Kusur,Gayanalata Vidhaya mandir Khadakwadi Kusur No.1,268
161 - Kumbhari,Vidhayamandir Kumbhari,268
162 - Pimpalwadi (Kusur),Vidhayamandir Kusur Bazarwadi No.1,268
163 - Napane,Gangeshwar Vidhayamandir Napane No.1,268
164 - Sonali,Zilla Parisad Shala Sonali No.1,268
165 - Kumbhawade,Kendrashala Vidhaya mandir Kumbhawade No.1 (East-West),268
166 - Jamdarwadi (Karul),Vidhayamandir Jamdarwadi (Karul),268
167 - Karul,Madhyamik Vidhayamandir Karul Khadakwadi,268
168 - Edgoan,Zilla Parisad Shri Rameshawar Vidhayamandir Edgoan,268
169 - Vabhave,Datt Vidhayamandir Vaibhavwadi (East Side),268
170 - Vabhave,Datt Vidhayamandir Vaibhavwadi (West Side),268
171 - Khambalwadi,Madhavrao Pawar Vidhayamandir Kokisare Khambalwadi,268
172 - Bandhawadi,Zilla Parishad Vidhaya mandir Bandhawadi,268
173 - Nadhawade,Kandrashala Nadhawade,268
174 - Nadhawade,Vidhayamandir Charwadi,268
175 - Nadhawade,Kandrashala Nadhawade,268
176 - Sardarwadi (Nadhawade),Zilla Parishad Vidhaya mandir Bramhmanadevwadi V Navaladevi,268
177 - Kokisare,Zilla Parishad Mahalaxmi Vidhaya mandir Kokisare (North side) New Building,268
178 - Kokisare,Zilla Parishad Mahalaxmi Vidhayamandir Kokisare (South side) New Building,268
179 - Khambale,Zilla Parishad Kendrashala No.1 Khambale,268
180 - Mohitewadi,Prathamik Shala Vidhayamandir No.2,268
181 - Sangulwadi,Kandrashala Sangulwadi,268
182 - Sangulwadi,Zilla Parishad Vidhayamandir Sangulwadi Fatakwadi,268
183 - Navle,Zilla Parishad Vidhayamandir Navale Gaonthan Dhangarwadi,268
184 - Shirale,Zilla Parishad Prathamik Shala Shirale,268
185 - Sadure,Zilla Parishad Prathamik Shala Sadure,268
186 - Arule,Zilla Parishad Prathamik Shala Arule,268
187 - Nimarule,Purn Prathamik Shala Nimarule,268
188 - Achirne,Vidhayamandir Shala Achirne No.1 (Malawadi),268
189 - Achirne,Vidhayamandir Shala Madhaliwadi Achirne,268
190 - Gadmath,Shala Vidhayamandir Gadmath No.1,268
191 - Lore (Ranewadi),Bharat Vidhayamandir Lore No.1,268
192 - Lore,Kendrashala Vidhayamandir Lore Helekarwadi,268
193 - Kurli,Vidhayamandir Kurli Khadakdara,268
194 - Kurli,Purn Prathamik Kendrashala Kurli No.1 (East side ),268
195 - karjirde,Z.P. Parth urdushala kharepatan Kaziwada,268
196 - shivajipeth kharepatan,Z.P.Parth kendrashala Kharepatan No.1,268
197 - shivaji kharepatan,Z.P. Parth. Urdushala Kharepatan Bandarwadi,268
198 - Vayangani,Z. P. Parth. Shala Vayangani,268
199 - kharepatan,"Seth Navinachrandr Mofatlal Uchch Madhy,Vidayalay Kharepatan Uttar Bhag",268
200 - kharepatan,"Seth Navinachrandr Mofatlal Uchch Madhy,Vidayalay Kharepatan Uttar Bhag",268
201 - chichvali,Z.P.Marathi shala Chinchavali Madhalivadi,268
202 - Kuraganvane,Z.P.Purn Prath Shala Kurangavane Khairat,268
203 - Sherpe,Z.P. Purn Prath shala sherpe,268
204 - Nadgive,Z.P.Parth .Shala Nadagive No.1,268
205 - Nadgive,Z.P.Parth .Shala Nadagive No.2,268
206 - Wargaon,Z.P.Parth .Shala Wargaon No-3 East,268
207 - Wargaon,Z.P.Parth .Shala Wargaon No-3 west,268
208 - Shidvane,Z.P.Purn Prath .Shala Shidavane No-1,268
209 - Saliste,Z.P.Kendra. Shala Saliste No-1,268
210 - Darum,Z.P.Purn Parth .Shala Darum No-1,268
211 - Talere,Z.P.Adarsh Parth. Shala Talere No-1 East,268
212 - Aundumbaranagar,Z.P.Adarsh Parth. Shala Talere No-1 West,268
213 - kasarde,Z.P.Purn Parth. Shala Kasarde No -3 Satamwadi,268
214 - Dhareshwar (kasarde),Z.P.Purn Parth .Shala Kasarde Devulkaravadi,268
215 - U.D.Gaonthan,Z.P.Parth. Shala Kasarde No.01,268
216 - Nagasavantawadi,Z.P.Parth. Shala Nagasavantavadi Kasarde,268
217 - Jabhulagaon Kasarde,Kasarde Madhy & Uchch Madhyamik Vidyalay Kasarde,268
218 - Jabhulagao Kasarde,Z.P.Parth. Shala Kasarde Bandwadi,268
219 - Ozaram,Z.P.Purn Parth. Shala Ozaram No-1,268
220 - Aynal,Z.P. Purn Prath Shala Aynal Manerwadi,268
221 - Otav,Ekatmik Bal Vikas seva Yojana Prakalp Kankavli Anganwadi Shala Otav Gavthan,268
222 - Koloshi,"Purn Parth, Shala Koloshi Hadapid",268
223 - Aslade,"Z.P. Parth, Shala Asalade No.1",268
224 - Nandgaon,Z.P. Kendrashala Nandgaon No.1 North,268
225 - Nandgaon,Z.P. Kendrashala Nandgaon No.1 South,268
226 - Nandgaon,Z.P. Kendrashala Nandgaon No.1 New Building South,268
227 - Savdav,"Purn Parth, Shala Savadav No.1",268
228 - Main,Purn Prath Shala Main Gaonthan,268
229 - Todavali,Jivan Shikshan Mandir Tondvali,268
230 - Piyali,"Z. P. Prath, Shala Piyali No. 1",268
231 - Vagheri,Z. P. Prath. Shala Vagheri No. 1,268
232 - Lore,Z. P. Purn Prath. Shala Lore No. 1 East,268
233 - Lore,Z. P. Purn Prath. Shala Lore No. 1 South,268
234 - Ghonasari,Kendriy Prath. Shala Ghonsari No.1 East,268
235 - Ghonasari,Kendriy Prath. Shala Ghonsari No.1 West,268
236 - Phondaghat,Z. P. Prath. Shala Phonda Sutarwadi,268
237 - Phondaghat,Jivan Shikshan Vidyamandir Phondaghat no.1 East,268
238 - Phondaghat,Jivan Shikshan Vidyamandir Phondaghat no.1 East,268
239 - Phondaghat,Jivan Shikshan Vidyamandir Phondaghat no.1West,268
240 - Phondaghat,Jivan Shikshan Vidyamandir Phondaghat no.1 New Building East,268
241 - Phondaghat,Jivan Shikshan Vidyamandir Phondaghat no.1 New Building West,268
242 - Phondaghat,Z. P. Prath. Shala Phonda Gangowadi North,268
243 - Phondaghat,Z. P. Prath. Shala Phonda Gangowadi South,268
244 - Navin Kurli,"Z. P. Purn Prath. Shala visthapit navin kurli vasahat, Phondaghat",268
245 - Tivare,Z. P. Prath. Shala Tivare Khalachiwadi,268
246 - Damre,Z. P. Purn Prath Kendra Shala Damare Tiware,268
247 - Belane khurd,Z. P. Purn Prath. Shala Belane Khurd,268
248 - karul,Z. P. Prath. Shala Karul,268
249 - Kondaye,Z. P. Shala Kondaye Gaonthan,268
250 - Hubarat,Z. P. Purn Prath. Humbrat Marathi Shala West,268
251 - Humarat,Z.P. purn Prath.Marathi Shala,268
252 - Tarandale,Z. P. Purn Prath. Shala Tarandale No. 1 East Bhag,268
253 - Tarandale,Z. P. Purn Prath. Shala Tarandale No. 1 West Bhag,268
254 - Bharani,Z.P. Purn Prath. Shala Bharani no. 1,268
255 - Bidawadi,Naringrakar Vidyamandir Z.P. Purn Prath Shala Bidwadi No.1 east,268
256 - Bidawadi,Naringrakar Vidyamandir Z.P. Purn Prath Shala Bidwadi No.1 West,268
257 - Pisekamate,Purn Prath. Shala Pisekamte Gavthan,268
258 - Varvade,Z. P. Prath. Shala Varavade No. 1,268
259 - Varvade,Z. P. Prath. Shala Varavade Hivalwadi,268
260 - Varavade Fanasanagar,Z. P. Prath. Shala Varavade Phanasanagar,268
261 - Janavali,Z. P. Purn Prath. Shala Janvali no.1 North,268
262 - Janavali,Z. P. Purn Prath. Shala Janvali no.1 South,268
263 - Sakedi,Z. P. Shala Sarswati Vidyamandir Sakedi no.1,268
264 - Karaje,Z. P. Prath. Shala Karanje no.1 Shirsatwadi,268
265 - Karaje,Z. P. Prath. Shala Karanje Ghanasmala,268
266 - Harakul Khurd,Z. P.Sindhudurg Purn Prath Shala Harkul Khurd Gavadewadi,268
267 - Harakul Khurd,Z. P. Purn Prath. Kendra Shala Harkul Khurd no.1,268
268 - HarakulKhurd,Z. P. Purn Prath. Shala Harkul Khurd Mohul,268
269 - Bhiravande,Z. P. Prath. Shala Bhirwande Jambhul Bhatale,268
270 - Ghandinagar,Z. P. Prath. Shala Vidyamandir Khalantar Bhirwande,268
271 - Bhiravade,Z. P. Prath. Shala Vidyamandir Bhirwande no.1,268
272 - Subhashnagar,Z. P. Prath. Shala Bhirwande Paratkam Wadi,268
273 - Kumbhavade,Z.P.Prath. Shala Kumbhavade no.1,268
274 - Natal,Z. P. Sindhudurg Prath. Shala Natal Humletemb,268
275 - Natal,Sindhudurg Kendrashala Natal No.1 (Rajwadi kendrashala Natal no.1),268
276 - Natal,Z. P. Prath. Shala Natal Khandarwadi,268
277 - Shivaji Nagar (Sangave ),Z. P. Prath. Shala Sangave Kanedipeth East,268
278 - Shivaji Nagar,Z.P.Prath.Shala Kanedi Bajarpeth,268
279 - Sangave,Z.P. Prath. Shala Sangave No.1 Gavakarwadi,268
280 - Harakul Budruk,Z.P.Prath. KendraShala harkul Bu. No.1 Uttar,268
281 - Harakul Budruk,L.G. Samant Vidyalay Harkul Budruk,268
282 - Hurakul Budruk,Z.P Prath. Shala Harkul Bu Koteshwar,268
283 - Harakul Budruk,Z.P Prath. Shala Harkul Budruk Jangmeshwar,268
284 - Nagve,Z.P.Purn Prath. Shala Nagave No.1,268
285 - Nagve,Z.P. Prath. Shala Nagave Kumbharwadi,268
286 - Kankavali,Shri Swayambhu Vidyamandir Kankavli No.2 East Bhag,268
287 - Kankavali,Shri Swayambhu Vidyamandir Kankavli No.2 West Bhag,268
288 - Kankavali,"Datta Vidyalay, Z.P. School Kankavli No.6",268
289 - Kankavali,R.B. Uchale Vidyamandir Z.P. Kendrashala Kankavli No.1 East,268
290 - Kankavali,"Shri sadguru Bhalchandra Maharaj Vidyalay, Kankavli No.3 East Bhag",268
291 - Kankavali,"Shri sadguru Bhalchandra Maharaj Vidyalay, Kankavli No.3 West Bhag",268
292 - Kankavali,Z.P. Shala Kankavli No.5 East,268
293 - Kankavali,Ekatmik Bal Vikas seva Yojana Prakalp Kankavli Anganwadi kankavli no.5,268
294 - Kankavali,Z.P. Prath Shala Kankavli No.5 West,268
295 - Kankavali,Vidyamandir Highschool Kankavli,268
296 - Kankavali,Vidyamandir Highschool Kankavli,268
297 - Kankavali,R.B. Uchale Vidyamandir Z.P. Kendrashala Kankavli No.1 West,268
298 - Ashiye,Z.P.Prath Shala Ashiye,268
299 - Kalmath,Z.P. Prath. Shala Kalmath Kumbharwadi East,268
300 - Kalmath,Z.P. Prath. Shala Kalmath Kumbharwadi West,268
301 - Kalmath,Z.P Prath. Shala Kalmath Bazarpeth No.1 East Bhag,268
302 - Kalmath,Z.P Prath. Shala Kalmath Bazarpeth No.1 West Bhag,268
303 - Kalmath,Z.P Prath. Shala Kalmath Bazarpeth No.1,268
304 - Kalmath,Z.P Prath. Shala Kalmath Gavadewadi Dakshin,268
305 - Kalmath,Z.P Prath. Shala Kalmath Gavadewadi Uttar,268
306 - Satral-Kasral,Z.P. Purn. Prath. Shala Satral-kasral South,268
307 - Vagde,Z.P. Purn Prath. Kendra Shala Vagade No.1 East,268
308 - Vagde,Z.P. Purn Prath. Kendra Shala Vagade No.1 West,268
309 - Halval,Z.P. Purn Prath KendraShala Halval No. 1 East,268
310 - Halval,Prath. Shala Halval No.2 Parabwadi,268
311 - Shivdav,Z.P. Prath. Shala Shivdav Tambatwadi,268
312 - Shivdav,Purn Prath Shala Shivdav Gaonkarwadi,268
313 - Dariste,Z.P. Sindhudurg Purn. Prath. Shala Dariste No.1,268
314 - Digavale,Z.P. Purn Prath. Shala Digvale Bamndewadi,268
315 - Digavale,Z.P. Purn Prath. Shala Digvale No.1,268
316 - Rajanagav,Z.P. Prath. Shala Digvale Ranjanwadi,268
317 - Naradave,Z.P. Prathmik Shala Nardave No.1,268
318 - Yavateshvar,Purn Prath. Shala Nardave Mahamadwadi,268
319 - Pimpalgao,Purn Prath. Shala Nardave Pimpalwadi,268
320 - Kalasuli Lingeswar Nagar,Z.P.Prath. Shala Kalsuli Gavasewadi,268
321 - Kalasuli Upnagar,Z.P. Prath. Shala Kalsuli No.1,268
322 - Ulhasanagar Kalasuli,Bhognath Vidyamandir Z.P. Adarsh Shala Kalsuli No.3 East,268
323 - Shrinagar,Z.P.Kendra Shala Kalsuli Dindvane,268
324 - Uttamnagar,Z.P. Prath Shala kalsuli Hardi,268
325 - Shiraval,Z.P. Prath Shala Shirval No.1,268
326 - Kasvan,Purn Prath. Shala Kasvan No.2,268
327 - Talvade,Purn Prath. Shala Talvade,268
328 - Bordave,Z.P.Kendrashala Bordave No.1 East,268
329 - Bordave,Z.P. Purn Prath. Shala Bordave No.3 Pendhari,268
330 - Osargaon,Z.P.Prathmik Shala Osargaon Khaskilwadi,268
331 - Osargaon,Purn Prathmik Shala Osargaon Kansali,268
332 - Osargaon,Z.P. Purn Prath Shala Osargaon No.1,268
