PS No & Name,Address,Constituency Number
249 - Bilur,Zilla Parishad PrimaryBoy's Kannad School Bilur East Side Facing Norther Steel Roof Room No.4 (whithin Gaonthan),288
250 - Bilur,Zilla Parishad.Primary Marathi Kendra & Salary Section School Bilur South Side Facing Norther Tile Roof Room within Gaonthan,288
251 - Bilur,Zilla Parishad Marathi Kendra School Bilur East Side Facing Norther Slab Room No.1 (OutSide Gaonthan),288
252 - Bilur,Zilla Parishad Marathi Kendra School Bilur East Side facing Norther Slab Room No.4(OutSide Gaonthan),288
253 - Bilur,Zilla Parishad Kannad Primary School Bilur facing South West Side Slab Room No.1 (outside Gaonthan),288
254 - Bilur,zilla Parishad Kannad Primary School Bilur facing South West Side Slab Room No.3(outside Gaonthan),288
255 - Khilaravadi,Zilla Parishad Primary Marathi School South Side Facing East Slab Room No.1,288
256 - Akundi,Zilla Parishad Primary Marathi School Slab Building North Side Room No 2,288
257 - Akundi,Zilla Parishad Primary Marathi School East Side Room No 1 facing North,288
258 - Vajravad,Zilla Parishad Marathi School Southern Facing R C C Room NO 1 Eastern Side,288
259 - Vajravad,Zilla Parishad. Primary Marathi Boys & Girl School eastern room no.1 facing north.,288
260 - Gugavad,"Zilla Parishad kannada school Gugavad,from east side north facing room no 1",288
261 - Gugavad,"Zilla Parishad kannada school,from east side,north facing room no 3",288
262 - Gugavad,"Zilla Parishad kannada schoolfrom east side, north facing room no 5",288
263 - Basaragi,"Zilla parishad primary kannada school Basaragi,north facing,from east side slab room no 1",288
264 - Basaragi,"Zilla Parishad Primary Kannada School Basargi, north facing building, from west side steel roof room no 1",288
265 - Sindur,"Zilla Parishad Primary School Sindur, Hexagonal Building, South facing room",288
266 - Sindur,"Zilla Parishad Primary School Sindur, north facing slab room no 1 from west side.",288
267 - Sindur,"Zilla Parishad Primary School Sindur, north facing slab room no 1 from east side.",288
268 - Umrani,"Ekatmik Balvikas Seva Scheme Project West Side, Facing East ,South Side Slab Building No.2",288
269 - Umrani,"Zilla Parishad Primary Kannad Girls School ,facing South side ,from west side room no.2",288
270 - Umrani,"Zilla Parishad Kannad Girls School East Side, facing South Slab Room NO.1",288
271 - Umrani,Zilla Parishad Primary Marathi Near Office West side facing South Room,288
272 - Umrani,Sarv shiksha abhiyan antrgat Zilla Parishad North East Side West Facing room No 3,288
273 - Dhulakaravadi,Zilla Parishad.Primary Marathi school. Northern facing room near Grampanchyat,288
274 - Asangi Turk,"Community Resource Center School, Hexagonal Building",288
275 - Kaganari,Z.P.Primary kannada Boys school. kaganari,288
276 - Konabagi,Zilla Parishad Primary Boys & girls Marathi School R.C.C. room no. 2 facing east.,288
277 - kontev Boblad,Zilla Parishad Primary Urdu School (Slab Building ),288
278 - Motewadi (kontev Boblad),Zilla Parishad Primary Marathi School R c c Building West Side Room No 2 Facing North,288
279 - kontev Boblad,Zilla Parishad Primary Marathi Girls School near Hanuman temple R C C room no 1 facing east.,288
280 - kontev Boblad,"Zilla Parishad .Marathi Boys School out side Village ,Facing East Hexagonal Slab Building",288
