PS No & Name,Address,Constituency Number
1 - Chikhali,Zilha Parishad Purv Madhyamik School Chikhali Room No. 1 Tah.Tumsar,60
2 - Devnara,Zilha Parishad Purv Madhyamik School Deonara Room No. 1 Tah.Tumsar,60
3 - Bajartola,Zilha Parishad Primary School Bajartola North Side Room No. 1 Tah.Tumsar,60
4 - Bajartola,Zilha Parishad Primary School Bajartola North Side Room No. 2 Tah.Tumsar,60
5 - Dongari Bu.,Zilha Parishad Kendriya Primary School Dongari Buj. North Side Room Tah.Tumsar,60
6 - Dongari Bu.,Zilha Parishad Kendriya Primary School Dongari Buj. East Side Room Tah.Tumsar,60
7 - Chandamara,Zilha Parishad Primary School Chandmara Room No. 1 Tah.Tumsar,60
8 - Lobhi,Zilha Parishad Aadarsh Purv Madhyamik School Lobhi East Side Room No. 2 Tah.Tumsar,60
9 - Lobhi,Zilha Parishad Aadarsh Purv Madhyamik School Lobhi West Side Room Tah.Tumsar,60
10 - Ashti,Zilha Parishad Purv Madhyamik School Ashti Chaukoni New Building West Side Room No. 1 Tah.Tumsar,60
11 - Ashti,Zilha Parishad Purv Madhyamik School Ashti New Building West Side Room No. 2 Tah.Tumsar,60
12 - Ashti,Zilha Parishad Purv Madhyamik School Ashti New Building Room No. 1 Tah.Tumsar,60
13 - Ashti,Zilha Parishad Purv Madhyamik School Ashti New Building Room No. 2 Tah.Tumsar,60
14 - Nakadongari,Zilha Parishad Junior College Room No. 3 Nakadongari Tah.Tumsar,60
15 - Nakadongari,Zilha Parishad High School And Art & Science Junior College Nakadongari Room No. 1 Tah.Tumsar,60
16 - Nakadongari,Zilha Parishad High School And Art & Science Junior College Nakadongari Room No. 2 Tah.Tumsar,60
17 - Pathari,Zilha Prishad Purv Madhyamik School Pathari Sauth Side Room Tah.Tumsar,60
18 - Pathari,Zilha Prishad Purv Madhyamik School Pathari North Side Room Tah.Tumsar,60
19 - Dhutera,Zilha Parishad Primary School Dhutera Tah.Tumsar,60
20 - Hirapur Hamesha,Zilha Parishad Primary School Hirapur Hamesha New Building Room No. 1 Tah.Tumsar,60
21 - Kawlewada,Zilha Parishad Purv Madhyamik School Kawlewada North Side Room Tah.Tumsar,60
22 - Kawlewada,Zilha Parishad Purv Madhyamik School Kawlewada East Side Room No. 2 Tah.Tumsar,60
23 - Chikhala,Zilha Parishad Purv Madhyamik School Chikhala Marathi Old Building Office West Side Room Tah.Tumsar,60
24 - Chikhala,Zilha Parishad Purv Madhyamik School Chikhala Marathi Old Building Office South Side Room No. 1 Tah.Tumsar,60
25 - Chikhala,Zilha Parishad Purv Madhyamik School Chikhala Marathi New Building Near Grampanchayat Office West Side Room No.1 Tah.Tumsar,60
26 - Yedarbuchi,Zilha Parishad Primary School Yedarbuchi North Side Room Tah.Tumsar,60
27 - Sundartola,Zilha Parishad Primary School Sundartola Tah.Tumsar,60
28 - Rajapur,Zilha Parishad Purv Madhyamik School Rajapur Room No. 1 Tah.Tumsar,60
29 - Rajapur,Zilha Parishad Purv Madhyamik School Rajapur North-East Side Room Tah.Tumsar,60
30 - Pavnarkhari Hamesha,Zilha Parishad Purv Madhyamik School Paunarkhari Hamesha (Ganeshpur) Room No. 1 Tah.Tumsar,60
31 - Balapur Hamesha,Zilha Parishad Primary School Balapur Hamesha Room No. 1 Tah.Tumsar,60
32 - Kurmuda,Zilha Parishad Primary School Kurmuda East Side Room Tah.Tumsar,60
33 - Gonditola,Zilha Parishad Primary School Gonditola Sauth Side Room Tah.Tumsar,60
34 - Alesur,Zilha Parishad Purv Madhyamik School Alesur East Side Room Tah.Tumsar,60
35 - Khapakhurd,Zilha Parishad Primary School Khapakhurd East Side Room Tah.Tumsar,60
36 - Rongha,Zilha Parishad Purv Madhyamik School Rongha Tah.Tumsar,60
37 - Mangarli,Zilha Parishad Purv Madhyamik School Mangarli Room No. 1 Tah.Tumsar,60
38 - Pipriya,Zilha Parishad Purv Madhyamik School Pipriya South Side Room No.1 Tah.Tumsar,60
39 - Gowaritola,Zilha Parishad Primary School Gowaritola Room No. 1 Tah.Tumsar,60
40 - Lendezari,Zilha Parishad Purv Madhyamik School Lendezari Room No. 1 Tah.Tumsar,60
41 - Mothagaon,Zilha Parishad Primary School Mothagaon New Building Room No. 1 Tah.Tumsar,60
42 - Asalpani,Zilha Parishad Primary School Asalpani New Building Room Tah.Tumsar,60
43 - Susurdoh Pu.,Zilha Parishad Primary School Punarvasan Garra (Susurdoh) Room No. 1 Tah.Tumsar,60
44 - Garra,Zilha Parishad Purv Madhyamik School New Building East Side Room No 1 Tah.Tumsar,60
45 - Garra,Zilha Parishad Purv Madhyamik School New Building East Side Room No 2 Tah.Tumsar,60
46 - Garra,Zilha Parishad Purv Madhyamik School Garra West Side Room No. 2 Tah.Tumsar,60
47 - Gobarwahi,Kendra Shala Mathura Prasad Isarka Purv Madhymik Vidhyalay Gobarwahi West Side Room Tah.Tumsar,60
48 - Gobarwahi,Kendra Shala Mathura Prasad Isarka Purv Madhymik Vidhyalay Gobarwahi East Side Room Tah.Tumsar,60
49 - Pavnarkhari,Mohanlal Goyanka Zilha Parishad Purv Madhyamik School Old Buiding East Side Room Tah.Tumsar,60
50 - Sitasawangi,Zilha Parishad Purv Madhyamik School Sitasawangi Bhojan Kaksha North Side Room Tah.Tumsar,60
51 - Sitasawangi,Zilha Parishad Purv Madhyamik School Sitasawangi Bhojan Kaksha South Side Room Tah.Tumsar,60
52 - Sitasawangi,Zilha Parishad Purv Madhyamik School Sitasawangi East Side Room Tah.Tumsar,60
53 - Sakkardara,Zilha Parishad Primary School Ghanod Room No. 1 Tah.Tumsar,60
54 - Sondya,Zilha Parishad Primary School Sondya Room No. 1 Th. Tumsar,60
55 - Warpindakepar,Zilha Parishad Primary School Warpindakepar Room No. 1 Tah.Tumsar,60
56 - Temani,Zilha Parishad Purv Madhyamik School Temani New Building South Room Tah.Tumsar,60
57 - Chandpur,Zilha Parishad Purv Madhyamik School Chandpur Room No. 1 Tah.Tumsar,60
58 - Sodepur,Zilha Parishad Primary School New Building Sodepur Room No. 1 Tah.Tumsar,60
59 - Khandal,Zilha Parishad Primary School Khandal East Side Tah.Tumsar,60
60 - Chicholi,Zilha Parishad Purv Madhyamik School Chicholi North Side Room Tah.Tumsar,60
61 - Chicholi,Zilha Parishad Purv Madhyamik School Chicholi South Side Room Tah.Tumsar,60
62 - Ambagad,Zilha Parishad Purv Madhyamik School Ambagad East Side Room No. 1 Tah.Tumsar,60
63 - Ambagad,Zilha Parishad Purv Madhyamik School Ambagad West Side Room No. 2 Tah.Tumsar,60
64 - Rampur Hamesha,Zilha Parishad Primary School Rampur Hamesha North Side Room Tah.Tumsar,60
65 - Sorana,Zilha Parishad Primary School Sorana East Side Room Tah.Tumsar,60
66 - Lanzera,Zilha Parishad Primary School Lanzera South Side Room Tah.Tumsar,60
67 - Deulagaon,Zilha Parishad Primary School Deulgaon Room No. 1 Tah. Moahadi,60
68 - Futala,Zilha Parishad Primary School Futala Room No. 1 Tah. Moahadi,60
69 - Hivara,Zilha Parishad Purv Madhyamik School Hiwara New Building South Side Room No. 1 Tah. Moahadi,60
70 - Bachhera,Zilha Parishad Primary School Bacchera Room No. 1 Tah. Moahadi,60
71 - Kandri,Zilha Parishad Primary School Kandri East Side Room No. 1 Tah. Moahadi,60
72 - Kandri,Zilha Parishad Primary Kanya School Kandri East Side Room No.2 Tah. Moahadi,60
73 - Kandri,Zilha Parishad Kendriy Purv Madhyamik School Kandri Room No. 1 Tah. Moahadi,60
74 - Kandri,Zilha Parishad Primary Middle School New Building Room No.2 Tah. Moahadi,60
75 - Jamb,Zilha Parishad Kanishtha Mahavidhyalay Jamb New Building West Side Room No.1 Tah. Moahadi,60
76 - Jamb,Zilha Parishad Kanishtha Mahavidhyalay Jamb New Building West Side Room No.2 Tah. Moahadi,60
77 - Jamb,Zilha Parishad Kanishtha Mahavidhyalay Jamb East Side New Building No.2 Room No.1 Tah. Moahadi,60
78 - Dhop,Zilha Parishad Purv Madhyamik School Dhop New Building West Side Room No. 1 Tah. Moahadi,60
79 - Dhop,Zilha Parishad Upper Primary School Dhop New Building West Side Room No. 2 Tah. Moahadi,60
80 - Lohara,Zilha Parishad Purv Madhyamik School Lohara Room No. 1 Tah.Tumsar,60
81 - Lohara,Zilha Parishad Purv Madhyamik School Lohara West Side Room Tah.Tumsar,60
82 - Tadgaon,Zilha Parishad Primary School Tadgaon New Building West Side Room No. 1 Tah. Moahadi,60
83 - Sihari,Zilha Parishad Primary School Sihari West Side Building Room No. 1 Tah. Moahadi,60
84 - Bapera A.,Zilha Parishad Primary School Bapera A. Room No. 1 Tah.Tumsar,60
85 - Hardoli A.,Zilha Parishad Primary School Hardoli A. Room No. 1 Tah.Tumsar,60
86 - Pavnara,Zilha Parishad Primary School Pavnara Room No. 1 Tah.Tumsar,60
87 - Sakhali,Zilha Parishad Purv Madhyamik School Sakhali Room No. 1 Tah.Tumsar,60
88 - Agri,Zilha Parishad Primary School Agri Room No. 1 Tah.Tumsar,60
89 - Sonegaon,Zilha Parishad Primary School Sonegaon Room No. 1 Tah.Tumsar,60
90 - Murali,Zilha Parishad Purv Madhyamik School Murali Room No. 1 Tah.Tumsar,60
91 - Mohadi Khapa,Zilha Parishad Purv Madhyamik School Mohadi Khapa South Side Room Tah.Tumsar,60
92 - Bramhantola,Zilha Parishad Primary School Bramhantola Trikoni Building Tah.Tumsar,60
93 - Mahalgaon,Zilha Parishad Purv Madhyamik School Mahalgaon New Building Tah.Tumsar,60
94 - Devsarra,Zilha Parishad Purv Madhyamik Kendra School Devsarra Room No. 1 Tah.Tumsar,60
95 - Bapera Si.,Zilha Parishad Primary School Bapera Si. East Side Room Tah.Tumsar,60
96 - Bapera Si.,Zilha Parishad Primary School Bapera Si.West Side Room Tah.Tumsar,60
97 - Gonditola,Zilha Parishad Primary School Gonditola Room No. 1 Tah.Tumsar,60
98 - Sukali Nakul,Zilha Parishad Primary School Sukali Nakul New Building Room No. 1 Tah.Tumsar,60
99 - Deoridev,Zilha Parishad Primary School Deoridev Room No. 1 Tah.Tumsar,60
100 - Binakhi,Zilha Parishad Primary School Binakhi Room No. 1 Tah.Tumsar,60
101 - Chulhad,Zilha Parishad High School Chulahd Center Building Room No. 1 Tah.Tumsar,60
102 - Chulhad,Zilha Parishad High School Chulahd Center Building Room No.2 Tah.Tumsar,60
103 - Chulhad,Zilha Parishad High School Chulahd East Building North Side Room Tah.Tumsar,60
104 - Gondekhari,Zilha Parishad Primary School Gondekhari Room No. 1 Tah.Tumsar,60
105 - Mangali,Zilha Parishad Primary School Mangali Room No. 1 Tah.Tumsar,60
106 - Sindapuri,Zilha Parishad Purv Madhyamik School Sindapuri North Side Middle Room Tah.Tumsar,60
107 - Sindapuri,Zilha Parishad Purv Madhyamik School Sindpuri South Side Middle Room Tah.Tumsar,60
108 - Sihora,Zilha Parishad Kendriy Primary School Sihora North Side Room Tah.Tumsar,60
109 - Sihora,Zilha Parishad Kendriy Primary School Sihora Middle Room Tah.Tumsar,60
110 - Sihora,Zilha Parishad High School Sihora Room No. 3 Tah.Tumsar,60
111 - Sihora,Zilha Parishad High School Sihora Room No. 4 Tah.Tumsar,60
112 - Borgaon,Zilha Parishad Primary School Borgaon Room No. 1 Tah.Tumsar,60
113 - Dhanegaon,Zilha Parishad Primary School Dhanegaon Room No. 1 Tah.Tumsar,60
114 - Ranera,Zilha Parishad Primary School Ranera Room No. 1 Tah.Tumsar,60
115 - Davezari,Zilha Parishad Primary School Davezari Room No. 1 Tah.Tumsar,60
116 - Pachara,Zilha Parishad Primary School Pachara Room No. 1 Tah.Tumsar,60
117 - Zarali,Zilha Parishad Primary School Zarali Room No. 1 Tah.Tumsar,60
118 - Pipara,Zilha Parishad Primary School Pipara New Building Room No. 1 Tah.Tumsar,60
119 - Mitewani,Zilha Parishad Primary School Mitewani Room No. 1 Tah.Tumsar,60
120 - Mitewani,Zilha Parishad Primary School Mitewani North Side Room No. 5 Tah.Tumsar,60
121 - Hingana,Zilha Parishad Purv Madhyamik School Hingana East Side Room No. 2 Tah.Tumsar,60
122 - Takala,Zilha Parishad Primary School Takala East Side Room Tah.Mohadi,60
123 - Usarra,Zilha Parishad Madhyamik School Usarra South Side Room No.1 Tah.Mohadi,60
124 - Usarra,Zilha Parishad Madhyamik School Usarra South Side Room No.2 Tah.Mohadi,60
125 - Salai Khurd,Zilha Parishad Madhyamik School Salai Khurd New Building North Side Room No. 1 Tah.Mohadi,60
126 - Salai Khurd,Zilha Parishad Madhyamik School Salai Khurd New Building North Side Room No. 2 Tah.Mohadi,60
127 - Malida,Zilha Parishad Primary School Malida Room No. 1 Tah.Mohadi,60
128 - Sakarla,Zilha Parishad Primary School Sakarla Room No. 1 Tah.Mohadi,60
129 - Khairlanji,Zilha Parishad Primary School Khairlanji East Side Room Tah.Mohadi,60
130 - Bondri,Zilha Parishad Primary School Bondri Room No. 1 Tah.Mohadi,60
131 - Ghorpad,Zilha Parisha Primary School Ghorpad Room No. 1 Tah.Mohadi,60
132 - Dhusala,Zilha Parishad Primary Middle School Dhusala Room No. 1 Tah.Mohadi,60
133 - Dhusala,Zilha Parishad Primary Middle School Dhusala Room No. 2 Tah.Mohadi,60
134 - Kati,Zilha Parishad Primary School Kati Room No. 1 Tah.Mohadi,60
135 - Navegaon Dhu.,Zilha Parishad Primary School Navegaon East Side Room No. 2 Tah.Mohadi,60
136 - Shivni,Zilha Parishad Primary Middle School Shiwani Room No. 1 Tah.Mohadi,60
137 - Chicholi,Zilha Parishad Primary School Chicholi Room No. 1 Tah.Mohadi,60
138 - Andhalgaon,Zilha Parishad Junior College Andhalgaon East Side Building NO.2 Room No. 1 Tah.Mohadi,60
139 - Andhalgaon,Zilha Parishad Junior College East Side Building NO.2 Andhalgaon Room No. 2 Tah.Mohadi,60
140 - Andhalgaon,Zilha Parishad Junior College West Side Building NO.2 Andhalgaon Room No. 1 Tah.Mohadi,60
141 - Andhalgaon,Zilha Parishad Junior College West Side Building NO.1 Andhalgaon Room No. 4 Tah.Mohadi,60
142 - Andhalgaon,Zilha Parishad Primary School Andhalgaon Room No. 2 Tah.Mohadi,60
143 - Paldongari,Zilha Parishad Primary School Paldongari New Building Room No. 1 Tah.Mohadi,60
144 - Tanga,Zilha Parishad Upper Primary School New Building South Side Room No. 1 Tah.Mohadi,60
145 - Salai Buj.,Zilha Parishad Purv Madhyamik School Salai Buj. South Side Building Room No. 1 Tah.Mohadi,60
146 - Salai Buj.,Zilha Parishad Purv Madhyamik School Salai Buj. South Side Building Room No. 2 Tah.Mohadi,60
147 - Katebamhani,Zilha Parishad Primary School Katebamhani North Side Room No.1 Tah.Mohadi,60
148 - Hasara,Zilha Parishad Purv Madhyamik School Hasara Old Building Room No. 1 Tah.Tumsar,60
149 - Hasara,Zilha Parishad Purv Madhyamik School Hasara New Building Room No. 2 Tah.Tumsar,60
150 - Mehegaon,Zilha Parishad Primary School Mehegaon Room No. 1 Tah.Tumsar,60
151 - Yerali,Zilha Parishad Purv Madhyamik School Yerali East Side Room Tah.Tumsar,60
152 - Yerali,Zilha Parishad Purv Madhyamik School Yerali Central West Room No.1 Tah.Tumsar,60
153 - Yerali,Zilha Parishad Purv Madhyamik School Yerali Central West Room No. 2 Tah.Tumsar,60
154 - Mohgaon Khadan,Zilha Parishad Purv Madhyamik School Mohgaon Khadan North Side Room No. 1 Tah.Tumsar,60
155 - Hardoli Si.,Zilha Parishad Purv Madhyamik School Hardoli Si.Old Building South Side Room Tah.Tumsar,60
156 - Hardoli Si.,Zilha Parishad Purv Madhyamik School Hardoli Si. New Building North Side Room Tah.Tumsar,60
157 - Rupera,Zilha Parishad Primary School Rupera Room No. 1 Tah.Tumsar,60
158 - Machhera,Zilha Parishad Primary School Machhera Room No. 1 Tah.Tumsar,60
159 - Silegaon,Zilha Parishad Purv Madhyamik School Silegaon East Side Room Tah.Tumsar,60
160 - Silegaon,Zilha Parishad Purv Madhyamik School Silegaon West Side Room Tah.Tumsar,60
161 - Wahani,Zilha Parishad Purv Madhyamik School Wahani Room No. 1 Tah.Tumsar,60
162 - Piparichunni,Zilha Parishad Primary School PipariChhuni East Side Room Tah.Tumsar,60
163 - Mandavi,Zilha Parishad Purv Madhyamik School Mandavi Room No. 1 Tah.Tumsar,60
164 - Paraswada Si.,Zilha Parishad Purv Madhyamik School Paraswada Si. Room No. 1 Tah.Tumsar,60
165 - Rengepar,Zilha Parishad Purv Madhyamik School Rengepar Room No. 1 Tah.Tumsar,60
166 - Panjara,Zilha Parishad Primary School Panjara Room No. 1 Tah.Tumsar,60
167 - Karkapur,Zilha Parishad Purv Madhyamik School Karkapur Room No. 1 Tah.Tumsar,60
168 - Sitepar,Zilha Parishad Primary School Sitepar Room No. 1 Tah.Tumsar,60
169 - Khairlanji,Zilha Parishad Primary School Khairlanji Room No. 1 Tah.Tumsar,60
170 - Dongarla,Zilha Parishad Purv Madhyamik School Dongarla Room No. 1 Tah.Tumsar,60
171 - Dongarla,Zilha Parishad Purv Madhyamik School North East Side Dongarla Tah.Tumsar,60
172 - Tumsar,Nagar Parishad Gurudev Chintaman Bisane Primary School South Side Room Tumsar,60
173 - Tumsar,Nagar Parishad Gurudev Chintaman Bisane Primary School Center Area Room Tumsar,60
174 - Tumsar,Muktabai Kanya School Tumsar North Side Room No. 1,60
175 - Tumsar,Muktabai Kanya School Tumsar North Side Room No. 2,60
176 - Tumsar,Muktabai Kanya School Tumsar South Side Room,60
177 - Tumsar,Muktabai Kanya School Tumsar Near Central Office,60
178 - Tumsar,Nagar Parishad Malviya Primary School Tumsar Room No 1,60
179 - Tumsar,Nagar Parishad Malviya Primary School Tumsar Room No 2,60
180 - Tumsar,Zilha Parishad Jijamata Primary School Tumsar,60
181 - Tumsar,Nagar Parishad Madhorao Patel Primary School Tumsar North Side Room,60
182 - Tumsar,Nagar Parishad Madhorao Patel Primary School Tumsar West Side Room,60
183 - Tumsar,Nagar Parishand Shankarrao Bangalkar Higher Primary School Sarvashiksha Abhiyan Room Tumsar,60
184 - Tumsar,Nagar Parishad Anganwadi Shankarrao Bangalkar Near Higher P‍‍rimary School New Building Tumsar,60
185 - Tumsar,Matoshri Vidhya Mandir South Side Bulding Room No. 1 Tumsar,60
186 - Tumsar,Matoshri Vidhya Mandir East Side Bulding Room No. 1 Tumsar,60
187 - Tumsar,Matoshri Vidhya Mandir East Bulding Room No. 2 Tumsar,60
188 - Tumsar,Shrimati Gopikabai Mahila Mahavidhyalay Room No. 1 Durga Nagar Tumsar,60
189 - Tumsar,Shrimati Gopikabai Mahila Mahavidhyalay Room No. 2 Durga Nagar Tumsar,60
190 - Tumsar,Shrimati Gopikabai Mahila Mahavidhyalay Room No. 3 Durga Nagar Tumsar,60
191 - Tumsar,Shrimati Gopikabai Mahila Mahavidhyalay Room No. 4 Durga Nagar Tumsar,60
192 - Tumsar,Shanti Convent And Public School Tumsar Room No. 1,60
193 - Tumsar,Shanti Convent And Public School Tumsar Room No. 2,60
194 - Tumsar,Nagar Parishad Fattechand Mor Hindi Praimary School Room No. 1 Tumsar,60
195 - Tumsar,Nagar Parishad Fattechand Mor Hindi Praimary School Room No. 2 Tumsar,60
196 - Tumsar,Lokmanya Tilak Rashtriya Vidhyalay Tumsar East Side Room No. 1,60
197 - Tumsar,Lokmanya Tilak Rashtriya Vidhyalay Tumsar East Side Room No. 2,60
198 - Tumsar,Nagar Parishad Neharu Vidhyalay New Building Tumsar Room No. 1,60
199 - Tumsar,Nagar Parishad Neharu Vidhyalay New Building Tumsar Room No.2,60
200 - Tumsar,Bharati Kanya Vidhyalay Tumsar North Side Room No. 1,60
201 - Tumsar,Bharati Kanya Vidhyalay Tumsar North Side Room No. 2,60
202 - Tumsar,Nagar Parishad Office Main Room Tumsar,60
203 - Tumsar,"Nagar Parishad Office, Tax Section Room Holl Tumsar",60
204 - Tumsar,Nagar Parishad Gandhi Primary School Tumsar West Side Room No. 2,60
205 - Tumsar,Nagar Parishad Gandhi Primary School Tumsar West Side Room No. 4,60
206 - Tumsar,"Nagar Parishad Kasturba Kanya Vidhyalay, Tumsar North Side Room.",60
207 - Tumsar,"Dhangare Primary School, Near Nagar Parishad Kasturba Kanya Vidhyalay Tumsar South Side Room.",60
208 - Tumsar,"Nagar Parishad Anganwadi, Near Dhangare Primary School Shiv Nagar Tumsar",60
209 - Tumsar,Purwashramichi Nagar Parishad Aa. Su. Pardhi Hindi School Tumsar Room No. 3,60
210 - Tumsar,Purwashramichi Nagar Parishad Aa. Su. Pardhi Hindi School Tumsar Room No. 1,60
211 - Tumsar,Nagar Parishad Rai Bahadur Govardhandas Primary School Tumsar East Side Room.,60
212 - Tamaswadi De.,Zilha Parishad Primary School Tamsawadi De. New Building Room NO.1 Tah.Tumsar,60
213 - Mangali De.,Zilha Parishad Primary School Mangali Room No. 1 Tah.Tumsar,60
214 - Mangali De.,Zilha Parishad Primary School Mangali New Building Room No. 1 Tah.Tumsar,60
215 - Khapa,Zilha Parishad Purv Madyamik School Khapa North Side Bulding Room NO.1 Tah.Tumsar,60
216 - Khapa,Zilha Parishad Purv Madyamik School Khapa South Side Bulding Room NO.1 Tah.Tumsar,60
217 - Vihirgaon,Zilha Parishad Primary School Vihirgaon Center Building Room Tah.Mohadi,60
218 - Bhikarkheda,Zilha Parishad Purv Madyamik School Bhikarkheda Room No. 1 Tah.Mohadi,60
219 - Dongargaon,Zilha Parishad Digital Primary School Dongargaon Room No. 1 Tah.Mohadi,60
220 - Dongargaon,Zilha Parishad Digital Primary School Dongargaon Room No. 4 Tah.Mohadi,60
221 - Pimpalgaon (Ka.),Zilha Parishad Primary Middle School Pimpalgaon (Ka.) Room No. 1 Tah.Mohadi,60
222 - Akola,Zilha Parishad Primary School Akola Room No. 1 Tah.Mohadi,60
223 - Salebardi,Zilha Parishad Primary School Salebardi Room NO.1 Tah.Mohadi,60
224 - Pandharabodi,Zilha Parishad Primary Middle School Old Building Pandharabodi Room NO.1 Tah.Mohadi,60
225 - Sitepar Z.,Zilha Parishad Primary School Sitepar ( Z.) Room NO.1 Tah.Mohadi,60
226 - Hardoli Z.,Zilha Parishad Primary Middle School Hardoli (Z.) Room No. 1 Tah.Mohadi,60
227 - Hardoli Z.,Zilha Parishad Primary Middle School Hardoli (Z.) Room No. 2 Tah.Mohadi,60
228 - Wadegaon,Zilha Parishad Primary Middle School Wadegaon Room No. 1 Tah.Mohadi,60
229 - Sirsoli,Zilha Parishad Primary Middle School Sirsoli Room NO.1 Tah.Mohadi,60
230 - Kanhalgaon Si.,Navprabhat High School Kanhalgaon Si. Room No. 1 Tah.Mohadi,60
231 - Mahalgaon,Zilha Parishad Primary School Morgaon New Building Room NO.1 Tah.Mohadi,60
232 - Kharbi,Zilha Parishad Purv Madhyamik School Kharbi New Building Room NO.1 Tah.Tumsar,60
233 - Kharbi,Zilha Parishad Purv Madhyamik School Kharbi New Building North Side Room No. 2 Tah.Tumsar,60
234 - Panjara De.,Zilha Parishad Primary School Panjara (De.) Room NO.1 Tah.Tumsar,60
235 - Paraswada De.,Zilha Parishad Primary School Parsawada De. Room No. 1 Tah.Tumsar,60
236 - Tudaka,Zilha Parishad Primary School Tudaka West Side Room Tah.Tumsar,60
237 - Shivani,Zilha Parishad Primary School Shivni Room NO.1 Tah.Tumsar,60
238 - Navargaon,Zilha Parishad Purv Madhyamik School Navargaon Room NO.1 Tah.Tumsar,60
239 - Umarwada,Zilha Parishad Purv Madhyamik School Umarwada New Building East Side Room Tah.Tumsar,60
240 - Umarwada,Zilha Parishad Purv Madhyamik School Umarwada New Building East Side Room No. 1 Tah.Tumsar,60
241 - Tamaswadi,Zilha Parishad Purv Madhyamik School Tamasawadi Room NO.1 Tah.Tumsar,60
242 - Bori,Zilha Parishad Purv Madhyamik School Bori East Side Room No. 1 Tah.Tumsar,60
243 - Bori,Zilha Parishad Purv Madhyamik School Bori East Side Room No. 2 Tah.Tumsar,60
244 - Koshti,Zilha Prishad Primary School Koshti New Building Room No. 1 Tah.Tumsar,60
245 - Narsingtola,Zilha Parishad Purv Madhyamik School Devhada Bu. (Narsingatola) Room No. 1 Tah.Mohadi,60
246 - Bamhani,Zilha Parishad Purv Madhyamik School Bamhani New Building South Side Room No. 2 Tah.Tumsar,60
247 - Bamhani,Zilha Parishad Purv Madhyamik School Bamhani New Building South Side Room No. 3 Tah.Tumsar,60
248 - Stationtoli,Zilha Parishad Primary School Stationtoli North Side Room Tah.Tumsar,60
249 - Madagi,Zilha Parishad Purv Madhyamik School Madagi North Side Room Tah.Tumsar,60
250 - Madagi,Zilha Parishad Purv Madhyamik School Madagi South Side Room Tah.Tumsar,60
251 - Devhadi,Zilha Parishad High School Devhadi North Side Room No. 1 Tah.Tumsar,60
252 - Devhadi,Zilha Parishad High School Devhadi New Building Room No. 2 Tah.Tumsar,60
253 - Devhadi,Zilha Parishad High School Devhadi New Building West Side Room No. 1 Tah.Tumsar,60
254 - Devhadi,Zilha Parishad Boy's Primary School Devhadi Tah.Tumsar,60
255 - Devhadi,Zilha Parishad Girls Primary School Devhadi Tah.Tumsar,60
256 - Mandhal,Zilha Parishad Purv Madhyamik School Mandhal New Building Room No. 2 Tah.Tumsar,60
257 - Mandhal,Zilha Parishad Purv Madhyamik School Mandhal New Building West Side Room No. 3 Tah.Tumsar,60
258 - Kushari,Zilha Parishad Middle Primary School Kushari Room No. 1 Tah.Mohadi,60
259 - Kushari,Zilha Parishad Middle Primary School Kushari Room No. 2 Tah.Mohadi,60
260 - Mohadi,Sulochana Devi Pardhi Sudama Kanishth Mahavidhyalay Mohadi Room No. 22 Tah.Mohadi,60
261 - Mohadi,Sulochana Devi Pardhi Sudama Kanishth Mahavidhyalay Mohadi Room No. 25 Tah.Mohadi,60
262 - Mohadi,Zilha Parishad Buniyadi Primary School Mohadi Room No. 1 Tah.Mohadi,60
263 - Mohadi,Zilha Parishad Buniyadi Primary School Mohadi Room No. 2 Tah.Mohadi,60
264 - Mohadi,Zilha Parishad Kanishtha Mahavidhyalay Mohadi East Side New Building Room No. 1 Tah.Mohadi,60
265 - Mohadi,Zilha Parishad Kanishtha Mahavidhyalay Mohadi East Side New Building Room No. 2 Tah.Mohadi,60
266 - Mohadi,Zilha Parishad Kanya Primary School Mohadi North Side New Building Room No. 1 Tah.Mohadi,60
267 - Mohadi,Zilha Parishad Kanya Primary School Mohadi North Side New Building Room No. 2 Tah.Mohadi,60
268 - Chichkheda,Zilha Parishad Primary School Chichakheda Room No. 1 Tah.Mohadi,60
269 - Mandesar,Zilha Parishad Middle Primary School Mandesar Room No. 1 Tah.Mohadi,60
270 - Mandesar,Zilha Parishad Middle Primary School Mandesar Room No. 2 Tah.Mohadi,60
271 - Khutsawari,Zilha Parishad Primary School Khutsawari Room No.1 Tah.Mohadi,60
272 - Chorkhamari,Zilha Parishad Middle Primary School Chorkhamari Room No. 1 Tah.Mohadi,60
273 - Khamari Buj.,Zilha Parishad Middle Primary School Khamari (Buj.) Room No. 1 Tah.Mohadi,60
274 - Khamari Buj,Zilha Parishad Middle Priamary School Khamari (Buj.) Room No. 2 Tah.Mohadi,60
275 - Pimpalgaon ( Z.),Zilha Parishad Middle Priamary School Pimpalgaon (Z.) Room No. 1 Tah.Mohadi,60
276 - Rampur,Zilha Parishad Primary School Rampur Room No. 1 Tah.Mohadi,60
277 - Pardi,Zilha Parishad Primary School Pardi Room No. 1 Tah.Mohadi,60
278 - Dahegaon,Zilha Parishad Primary School Dahegaon East Side New Building Tah.Mohadi,60
279 - Roha,Zilha Parishad Purv Madhyamik School Roha Room No. 1 Tah.Mohadi,60
280 - Roha,Zilha Parishad Purv Madhyamik School Roha Room No. 2 Tah.Mohadi,60
281 - Chargaon,Zilha Parishad Primary School Chargaon North Side Room Tah.Tumsar,60
282 - Sukali De.,Zilha Parishad Primary School Sukali (De.) Room No. 1 Tah.Tumsar,60
283 - Sukali De.,Zilha Parishad Primary School Sukali De. North Side Room No. 2 Tah.Tumsar,60
284 - Dhorwada,Zilha Parishad Purv Madyamik School Dhorwada Room No. 1 Tah.Tumsar,60
285 - Nilaj Buj.,Zilha Parishad Purv Madyamik School Nilaj ( Buj.) Room No. 1 Tah.Mohadi,60
286 - Nilaj Buj.,Zilha Parishad Purv Madyamik School Nilaj ( Buj.) Room No. 2 Tah.Mohadi,60
287 - Devhada Khurd,Zilha Parishad Purv Madyamik School Devhada Khurd Room No. 1 Tah.Mohadi,60
288 - Devhada Khurd,Zilha Parishad Purv Madyamik School Devhada Khurd Room No. 2 Tah.Mohadi,60
289 - Devhada Buj.,Zilha Parishad Purv Madyamik School Devhada Buj. Room No.1 Tah.Mohadi,60
290 - Navegaon Buj.,Zilha Parishad Purv Madyamik School Navegaon ( Buj.) Room No. 1 Tah.Mohadi,60
291 - Mohgaon K.,Zilha Parishad Primary School Mohgaon ( k.) South Side Room No. 1 Tah.Mohadi,60
