PS No & Name,Address,Constituency Number
1 - Keli,Z.P.P.S. Keli RoomNo. 01,92
2 - Keli Tanda,Z.P.P.S. Keli Tanda RoomNo. 01,92
3 - Pardi Sawali,Z.P.P.S. Pardi Sawali RoomNo. 01,92
4 - Sawali Khurd,Z.P.P.S. Sawali Khurd RoomNo. 01,92
5 - Kamtha,Z.P.P.S. Kamtha Room No. 01,92
6 - Jodpimpari,Z.P.P.S.Jodpimpari RoomNo. 01,92
7 - Rupur,Z.P.P.S. Rupur Camp RoomNo. 01,92
8 - Rupur Tanda,Z.P.P.S. Rupur Tanda RoomNo. 01,92
9 - Gojegaon,Z.P.P.S. Gojegaon RoomNo. 01,92
10 - Dhar,Z.P.P.S. Dhar RoomNo. 01,92
11 - Chimegaon,Z.P.P.S. Chimegaon RoomNo. 01,92
12 - Salna,Z.P.P.S. Salna RoomNo. 01,92
13 - Salna,Z.P.P.S. Salna RoomNo. 02,92
14 - Ranmeshwar,Z.P.P.S. Rameshwar RoomNo. 01,92
15 - Hiwarkheda,Z.P.P.S. Hiwarkheda RoomNo. 01,92
16 - Yeli,Z.P.P.S. Yeli RoomNo. 01,92
17 - Daudgaon,Z.P.P.S. Daudgaon RoomNo. 01,92
18 - Landala,Z.P.P.S. Landala RoomNo. 01,92
19 - Undegaon,Z.P.P.S. Undegaon RoomNo. 01,92
20 - Ankhali,Z.P.P.S. Ankhali RoomNo. 01,92
21 - Ankhali Wadi,Z.P.P.S. Ankhaliwadi RoomNo. 01,92
22 - Pota Bu.,Z.P.P.S. Pota Bu. RoomNo. 01,92
23 - Pota Khurd,Z.P.P.S. Pota Khurd RoomNo. 02,92
24 - Anjanwadi,Z.P.P.S. Anjanwadi RoomNo. 01,92
25 - Kondsi Bu.,Z.P.P.S. Kondsi Bu. RoomNo. 01,92
26 - Wagarwadi,Z.P.P.S. Wagarwadi RoomNo. 01,92
27 - Wagarwadi Tanda,Z.P.P.S. Wagarwadi Tanda RoomNo. 01,92
28 - Nageshwadi,Z.P.P.S. Nageshwadi Room No. 01,92
29 - Nageshwadi,Z.P.P.S. Nageshwadi RoomNo. 02,92
30 - Daregaon,Z.P.P.S. Daregaon Room No. 01,92
31 - Daregaon,Z.P.P.S. Daregaon Room No. 02,92
32 - Asola T. Lakh,Z.P.P.S. Asola T. Lakh RoomNo. 01,92
33 - Asola T. Lakh,Z.P.P.S. Asola T. Lakh RoomNo. 02,92
34 - Lohra Bu.,ZPCPS Lohra Bu. RoomNo. 01,92
35 - Lohra Bu.,ZPCPS Lohra Bu. RoomNo. 02,92
36 - Revansidh Tanda,Z.P.P.S. Revansidh Tanda RoomNo. 01,92
37 - Lohra Khurd,Post Basic High SchoolAshramshalaLohra Khurd RoomNo. 01,92
38 - Pangra Shinde,"Z.P.C.P. School, Pangra Shinde South wing, Room no. 1",92
39 - Pangra Shinde,"Z.P.C.P. School, Pangra Shinde South wing, Room no. 2",92
40 - Pangra Shinde,"Z.P.C.P. School, Pangra Shinde North wing, Room no. 2",92
41 - Wapti,"Bahirji Smarak Vidyalaya, Wapti Room no.1",92
42 - Wapti,"Bahirji Smarak Vidyalaya, Wapti Room no. 2",92
43 - Sirli,Z.P.P.S. Sirli Room no.1,92
44 - Sirli,Z.P.P.S. Sirli Room no.2,92
45 - Rajwadi,Z.P.P.S. Rajwadi Room no.1,92
46 - Laxman Naik Tanda,Zilla Parishad Primary School Laxman Naik Tanda Room No. 01,92
47 - Sarangwadi,Zilla Parishad Primary School Sarangwadi Room No. 01,92
48 - Gavalewadi,Zilla Parishad Primary School Gavalewadi RoomNo.01,92
49 - Kathoda Tanda,Zilla Parishad Primary School Kathoda Tanda RoomNo. 01,92
50 - Kathoda Tanda,Zilla Parishad Primary School Kathoda Tanda RoomNo. 02,92
51 - Chondhi T. Shahapur,Zilla Parishad Primary Schoo Chondhi T. Shahapur RoomNo.01,92
52 - Asola T. Aundha,Zilla Parishad Primary School AsolaT. Aundha RoomNo. 01,92
53 - Asola T. Aundha,Zilla Parishad Primary School Asola T. Aundha N.V. Room No.01,92
54 - Takalgavhan,Zilla Parishad Primary School Takalgavhan RoomNo. 01,92
55 - Nalegaon,Zilla Parishad Primary School Nalegaon RoomNo. 01,92
56 - Ajarsonda,Zilla Parishad Primary School Ajarsonda RoomNo. 01,92
57 - Ajarsonda,Zilla Parishad Primary School Ajarsonda RoomNo. 02,92
58 - Chincholi Niloba,Zilla Parishad Primary School Chincholi Niloba RoomNo.01,92
59 - Chincholi Niloba,Zilla Parishad Primary School Chincholi Niloba RoomNo.02,92
60 - Jalalpur,Zilla Parishad Primary School Jalalpur RoomNo. 01,92
61 - Perjabad,Zilla Parishad Primary School Perjabad RoomNo. 01,92
62 - Berula,Zilla Parishad Primary School BerulaRoomNo .01,92
63 - Nandkheda,Zilla Parishad Primary School Nandkheda RoomNo. 01,92
64 - Ukhali,Zilla Parishad Primary School Ukhali RoomNo. 01,92
65 - Ukhali,Zilla Parishad Primary School Ukhali RoomNo. 02,92
66 - Jawala Bazar,Zilla Parishad Central Primary School JawalaBazar North Side Room No. 01,92
67 - Jawala Bazar,Zilla Parishad CentralPrimary School JawalaBazar North Side Room No. 02,92
68 - Jawala Bazar,Zilla Parishad CentralPrimary School JawalaBazar North Side Room No. 03,92
69 - Jawala Bazar,Grampanchayat Sarvajanik Vachnalaya Near Anganwadi JawalaBazar RoomNo .01,92
70 - Jawala Bazar,Anganwadi No. 02 Near Grampanchayat Sarvajanik Vachnalaya Jawala Bazar RoomNo. 01,92
71 - Jawala Bazar,New Anganwadi Near New Grampanchayat JawalaBazar RoomNo. 01,92
72 - Jawala Bazar,Zilla Parishad CentralPrimary School JawalaBazar West Side Room No. 01,92
73 - Jawala Bazar,Zilla Parishad CentralPrimary School JawalaBazar West Side Room No. 02,92
74 - Jawala Bazar,ZillaParishad High School Jawalabazar West Side RoomNo. 01,92
75 - Jawala Bazar,ZillaParishad High School Jawalabazar West Side RoomNo. 02,92
76 - Jawala Bazar,"Indira Gandhi Kanya Vidyalaya, Jawala Bazar Room No. 1",92
77 - Jawala Bazar,"Indira Gandhi Kanya Vidyalaya, Jawala Bazar Room No. 2",92
78 - Purjal,Zilla Parishad Primary School Purjal Room No. 01,92
79 - Purjal,Zilla Parishad Primary School Purjal Room No. 02,92
80 - Shirla,Zilla Parishad Primary School ShirlaRoomNo. 01,92
81 - Shirla Tanda,Zilla Parishad Primary School ShirlaTanda RoomNo .01,92
82 - Shirad Shahapur,ZillaParishad Primary School Shirad Shahapur Room No. 01,92
83 - Shirad Shahapur,ZillaParishad Primary School Shirad Shahapur Room No. 02,92
84 - Shirad Shahapur,Shri Shanti Vidya Mandir Secondary and Higher Secondary Vidyalaya Shirad Shahapur Room NO. 01,92
85 - Shirad Shahapur,Shri Shanti Vidya Mandir Secondary and Higher Secondary Vidyalaya Shirad Shahapur Room NO. 02,92
86 - Shirad Shahapur,Shri Shanti Vidya Mandir Secondary and Higher Secondary Vidyalaya Shirad Shahapur Room NO. 03,92
87 - Sendursana,Zilla Parishad Primary School Sendursana RoomNo. 01,92
88 - Sendursana,Zilla Parishad Primary School Sendursana RoomNo. 02,92
89 - Marsul T. Sendursana,Z.P.P.S. Marsul T. Sendursana Room no.1,92
90 - Chondi T. Sendursana,Z.P.P.S. Chondi T. Sendursana Room no.1,92
91 - Chondi T. Sendursana,Z.P.P.S. Chondi T. Sendursana Room no.2,92
92 - Khambala,Z.P.P.S. Khambala Room no.1,92
93 - Khaparkheda,Z.P.P.S. Khaparkheda Room no.1,92
94 - Kupti,Z.P.P.S. Kupti Room no.1,92
95 - Kothari,Z.P.P.S. Kothari Room no.1,92
96 - Kotharwadi,Z.P.P.S. Kotharwadi Room no.3,92
97 - Sukali,Z.P.P.S. Sukali East wing Room no.1,92
98 - Sukali,Z.P.P.S. Sukali West wing Room no.2,92
99 - Donwada,Z.P.P.S. Donwada East wing Room no.1,92
100 - Donwada,Z.P.P.S. Donwada East wing Room no.2,92
101 - Kurundwadi,Z.P.P.S. Kurundwadi Room no.1,92
102 - Selu,Z.P.P.S. Selu East wing Room no.1,92
103 - Wartala,Z.P.P.S. Wartala East wing Room no.2,92
104 - Wai T. Dhamangaon,Z.P.P.S. Wai T. Dhamangaon Room no.1,92
105 - Wai T. Dhamangaon,Z.P.P.S. Wai T. Dhamangaon Room no.2,92
106 - Waghi,Z.P.P.S. Waghi Room no.1,92
107 - Mardi,Zilla Parishad Primary School Mardi Room No. 01,92
108 - Umra,Zilla Parishad Primary School Umara Room No. 01,92
109 - Nahad,Z.P.P.S. Nahad South wing Room no.1,92
110 - Nahad,Z.P.P.S. Nahad South wing Room no.2,92
111 - Nagapur,Z.P.P.S. Nagapur Room no.1,92
112 - Wadad,Z.P.P.S. Wadad Room no.1,92
113 - Wadad,Z.P.P.S. Wadad Room no.2,92
114 - Ranjala,Z.P.P.S. Ranjala Room no.1,92
115 - Ranjala,Z.P.P.S. Ranjala Room no.2,92
116 - Karanjala,Z.P.P.S. Karanjala South wing Room no.1,92
117 - Karanjala,Z.P.P.S. Karanjala North wing Room no.1,92
118 - Karanjala,Z.P.P.S. Karanjala South wing Room no.2,92
119 - Tapovan,Zilla Parishad Primary SchoolTapovan Room No. 01,92
120 - Tapovan,Zilla Parishad Primary SchoolTapovan Room No. 02,92
121 - Parli,Z.P.P.S. Parli Room no.1,92
122 - Mategaon,Z.P.P.S. Mategaon Room no.1,92
123 - Bori Sawant,Z.P.P.S. Bori Sawant Room no.1,92
124 - Bori Sawant,Z.P.P.S. Bori Sawant Room no.2,92
125 - Gunda,Z.P.P.S. Gunda New Building Room no.1,92
126 - Gunda,Z.P.P.S. Gunda New Building Room no.2,92
127 - Karanji,Z.P.P.S. Karanji Room no.1,92
128 - Kudala,Z.P.P.S. Kudala West wing Room no.1,92
129 - Puyani Bu.,Z.P.P.S. Puyani Bu. Room no.1,92
130 - Hiradgaon,Z.P.P.S. Hiradgaon Room no.1,92
131 - Pangra T. Dhamangaon,Z.P.P.S. Pangra T. Dhamangaon Room no.1,92
132 - Korta,Z.P.P.S. Korta Room no.1,92
133 - Jununa,Z.P.P.S. Jununa Room no.1,92
134 - Amba,Z.P.P.S. Amba North Side Room no.1,92
135 - Amba,Z.P.P.S. Amba North Side Room no.3,92
136 - Amba,Z.P.P.S. Amba North Side Room no.2,92
137 - Amba,Z.P.P.S. Amba North Side Room no.4,92
138 - Kurunda,"Z.P.C.P.S. New Building, Kurunda Room no.2",92
139 - Kurunda,"Kendriya Kanya School, New Building, Kurunda South wing, Room no.5",92
140 - Kurunda,Z.P.P.S.Nehru nagar Room no.3,92
141 - Kurunda,"Kendriya Kanya School, New Building, Kurunda South wing, Room no.11",92
142 - Kurunda,"Z.P.P.S. Urdu, Kurunda Room no. 1",92
143 - Kurunda,"Z.P.P.S. Urdu, Kurunda Room no. 2",92
144 - Kurunda,"Z.P.Madhayamik, School Kurunda Room no.1",92
145 - Kurunda,"Z.P.Madhayamik, School Kurunda Room no.2",92
146 - Kurunda,"Z.P.Madhayamik, School Kurunda Room no.3",92
147 - Dabhadi,Z.P.P.S. Dabhadi Room no.1,92
148 - Pardi Khu.,Z.P.P.S. Pardi Khu. Room no.1,92
149 - Pardi Khu.,Z.P.P.S. Pardi Khu. Room no.2,92
150 - Kanosa,Z.P.P.S. Kanosa Room no.1,92
151 - Pardi Bu.,Anganwadi Pardi Bk Room no.1,92
152 - Pardi Bu.,Anganwadi Pardi Bk Room no.2,92
153 - Digras Khu.,Z.P.P.S. Digras Khu. Room no.2,92
154 - Pimprala,Z.P.P.S. Pimprala Room no.1,92
155 - Pimprala,Z.P.P.S. Pimprala Room no.2,92
156 - Mahagaon,Z.P.P.S. Mahagaon Room no.1,92
157 - Bhendegaon,Z.P.P.S. Bhendegaon Room no.1,92
158 - Dhamangaon,Z.P.P.S. Dhamangaon Room no.1,92
159 - Dhamangaon,Z.P.P.S. Dhamangaon Room no.2,92
160 - Barepurwadi,Z.P.P.S. Barepurwadi Room no.1,92
161 - Puyani Khu.,Z.P.P.S. Puyani Khu. Room no.1,92
162 - Loleshwar,Z.P.P.S. Loleshwar Room no.1,92
163 - Tembhurni,Z.P.P.S. Tembhurni Room no.1,92
164 - Tembhurni,Z.P.P.S. Tembhurni Room no.2,92
165 - Hapsapur,Z.P.P.S. Hapsapur Room no.1,92
166 - Kalamba,Z.P.P.S. Kalamba Room no.1,92
167 - Adgaon,Z.P.P.S. Adgoan Room no.1,92
168 - Adgaon,Z.P.P.S. Adgoan Room no.2,92
169 - Adgaon,Z.P.P.S. Adgoan Room no.3,92
170 - Tuljapurwadi,Z.P.P.S. Tuljapurwadi Room no.1,92
171 - Darephal,Z.P.P.S. Darephal New Building Room no.1,92
172 - Darephal,Z.P.P.S. Darephal New Building Room no.2,92
173 - Viregaon,Z.P.P.S. Viregaon Room no.1,92
174 - Viregaon,Z.P.P.S. Viregaon Room no.2,92
175 - Akoli,Z.P.P.S. Akoli East wing Room no.1,92
176 - Akoli,Z.P.P.S. Akoli West wing Room no.1,92
177 - Dagadgaon,Z.P.P.S.Dagadgaon Room no.1,92
178 - Mahatargaon,Z.P.P.S. Mahatargaon Room no.1,92
179 - Borala,Z.P.P.S. Borala Room no.1,92
180 - Borala,Z.P.P.S. Borala Room no.2,92
181 - Kawtha,Z.P.P.S. Kawtha East wing Room no.1,92
182 - Kawtha,Z.P.P.S. Kawtha West wing Room no.1,92
183 - Mahmadpurwadi,Z.P.P.S.Mahmadpurwadi Room no.1,92
184 - Khudnapur,Z.P.P.S. Khudnapur Room no.1,92
185 - Kinhola,Z.P.P.S. Kinhola Room no.1,92
186 - Kinhola,Z.P.P.S. Kinhola Room no.2,92
187 - Somthana,Z.P.P.S. Somthana Room no.1,92
188 - Somthana,Z.P.P.S. Somthana Room no.2,92
189 - Girgaon,"Bahirji Smarak Vidyalaya, Girgaon Room no.1",92
190 - Girgaon,"Bahirji Smarak Vidyalaya, Girgaon East wing Room no.2",92
191 - Girgaon,"Bahirji Smarak Vidyalaya, Girgaon East wing Room no.3",92
192 - Girgaon,"Z.P.C.P. School, Girgaon North wing, Room no. 1",92
193 - Girgaon,"Z.P.C.P. School, Girgaon North wing, Room no. 2",92
194 - Girgaon,"Z.P.C.P. School, Girgaon New Building, Room no. 2",92
195 - Girgaon,"Z.P.C.P. School, Girgaon New Building, Room no. 3",92
196 - Girgaon,"Z.P.C.P. School, Girgaon New Building, Room no. 5",92
197 - Parjana,Z.P.P.S. Parjana Room no.1,92
198 - Khajmapurwadi,Z.P.P.S. Khajmapurwadi Room no.1,92
199 - Borgaon Bu.,Z.P.P.S. Borgaon Bu. Room no.1,92
200 - Rodga,Z.P.P.S. Rodga Room no.1,92
201 - Reulgaon,Z.P.P.S. Reulgaon Room no.1,92
202 - Balegaon,Z.P.P.S. Balegaon Room no.1,92
203 - Balegaon,Z.P.P.S. Balegaon Room no.2,92
204 - Savangi Bu.,Z.P.P.S. Savangi Bu. Room no.1,92
205 - Dhaulgaon,Z.P.P.S. Dhaulgaon Room no.1,92
206 - Bramhangaon Bu.,Z.P.P.S. Bramhangaon Bu. Room no.1,92
207 - Sonna T. Hatta,Z.P.P.S. Sonna T. Hatta Room no.1,92
208 - Hatta,"Z.P.Girl's School, Hatta Room no.1",92
209 - Hatta,"Z.P.Girl's School, Hatta East wing Room no.2",92
210 - Hatta,"Z.P.Girl's School, Hatta North wing Room no.4",92
211 - Hatta,"Z.P.High School, Hatta East wing Room no.1",92
212 - Hatta,"Z.P.High School, Hatta West wing Room no.2",92
213 - Hatta,"Z.P.High School, Hatta West wing Room no.2",92
214 - Chikhali,Z.P.P.S. Chikhali Room no.1,92
215 - Aral,"Z.P.C.P. School, Aral East wing, Room no. 1",92
216 - Aral,"Z.P.C.P. School, Aral North wing, Room no. 2",92
217 - Aral,"Z.P.C.P. School, Aral East wing, Room no. 2",92
218 - Telgaon,Z.P.P.S. Telgaon Room no.1,92
219 - Ranjona,Z.P.P.S. Ranjona Room no.1,92
220 - Ranjona,Z.P.P.S. Ranjona Room no.2,92
221 - Khandegaon,Z.P.C. P.S. Khandegaon Room no.1,92
222 - Khandegaon,Z.P.C. P.S. Khandegaon Room no. 3,92
223 - Khandegaon,Z.P.C.P. School Khandegaon Room no.2,92
224 - Pangra sati,Z.P.P.S. Pangra sati Room no.1,92
225 - Basmath,"Fulsing Naik Primary School, Marathi Medium, Shukrawar Peth, Basmath, Room no.1",92
226 - Basmath,"Fulsing Naik Primary School, Marathi Medium, Shukrawar Peth, Basmath, Room no.2",92
227 - Basmath,"Z.P.P.S. Boudhawada, New Building East wing, Room no.3",92
228 - Basmath,"Z.P.P.S. Boudhawada, New Building East wing, Room no.2",92
229 - Basmath,"Z.P.P.S. Boudhawada, New Building East wing, Room no.4",92
230 - Basmath,"Md.Nizamodding Qureshi Urdu Junior College, Arts Branch, Basmath, Room No.1",92
231 - Basmath,"Sidheshwar Primary School, Near Sidheshwar Math, Room No.1",92
232 - Basmath,"Md.Nizamodding Qureshi Urdu Junior College, Arts Branch, Basmath, Room No.2",92
233 - Basmath,"Rajiv Gandhi Primary School, Shukrawar Peth, Basmath Room no.1",92
234 - Basmath,"Rajiv Gandhi Primary School, Shukrawar Peth, Basmath Room no.2",92
235 - Basmath,"Govt. Technical Vidyalaya Center, Basmath Room no.1",92
236 - Basmath,"Govt. Technical Vidyalaya Center, Basmath Room no.2",92
237 - Basmath,"Fulsing Naik Primary School, Urdu Medium, Lain Talab, Basmath Room no.1",92
238 - Basmath,"Z.P.P. Girl's School,, Brahmin Galli, Basmath Room no.1",92
239 - Basmath,"Z.P. Girl's School, Urdu Medium, Tatt's School, Basmath Room no.1",92
240 - Basmath,"Z.P. Girl's School, Urdu Medium, Tatt's School, Basmath Room no.3",92
241 - Basmath,"Z.P. Girl's School, Urdu Medium, Tatt's School, Basmath Room no.4",92
242 - Basmath,"Saraswati Niketan High School, North wing Room no.2",92
243 - Basmath,"Saraswati Niketan High School, East wing Room no.1",92
244 - Basmath,"Saraswati Niketan High School, West wing Room no.2",92
245 - Basmath,B & C Sub Divi.Office Basmath East wing Room no.1,92
246 - Basmath,B & C Sub Divi.Office Basmath East wing Room no.3,92
247 - Basmath,"BRGF Hall Panchyat Samiti Office, Basmat Room No.1",92
248 - Basmath,B & C Sub Divi.Office Basmath Room no.4,92
249 - Basmath,"BRC Hall Panchayat Samiti office Area, Basmath Room no.1",92
250 - Basmath,"Bahirji Smarak Vidyalaya, Parimary departmen Basmath West side Room no. 07",92
251 - Basmath,"Bahirji Smarak Vidyalaya, Parimary departmen Basmath West side Room no. 08",92
252 - Basmath,"Bahirji Smarak Vidyalaya, Basmath Room no. 1",92
253 - Basmath,"Bahirji Smarak Vidyalaya, Basmath Room no. 2",92
254 - Basmath,"Mahatma Gandhi Vidyalaya, Somwar Peth, Basmath East wing Room no.1",92
255 - Basmath,"Mahatma Gandhi Vidyalaya, Somwar Peth, Basmath East wing Room no.2",92
256 - Basmath,"Samaj Mandir, Somwar Peth, Muncipal Council, Bamath. Room No.1",92
257 - Basmath,"Mahatma Gandhi Midal Vidyalaya, Kawtha road,Basmath Room no.1",92
258 - Basmath,"Mahatma Gandhi Midal Vidyalaya, Kawtha road,Basmath Room no.2",92
259 - Basmath,"Mahatma Gandhi Midal Vidyalaya, Kawtha road,Basmath Room no.3",92
260 - Basmath,"Z.P.C.P.Girl's School, Mangalwar peth Room no.1",92
261 - Basmath,"Z.P.C.P.Girl's School, Mangalwar peth Room no.2",92
262 - Basmath,"Bahirji Smarak Viddyalaya, Basmath Room, No. 40",92
263 - Basmath,"Taluka Nirishak Bhumi Abhilekh Kayalaya, Basmath Room no.1",92
264 - Basmath,"Bahirji Smarak Viddyalaya, Primary department, Basmath West side Room, No. 4",92
265 - Basmath,"Bahirji Smarak Viddyalaya, Primary department, Basmath West side Room, No. 6",92
266 - Basmath,"Bahirji Smarak Viddyalaya, Primary department, Basmath West side (Kindergarten)",92
267 - Basmath,"Z.P. High School, New Building Basmath Room no.3",92
268 - Basmath,"Z.P. High School, New Building Basmath Room no.1",92
269 - Basmath,"Z.P. High School, New Building Basmath Room no.2",92
270 - Basmath,"Vivek Vardhini High School, Basmath Room no.1",92
271 - Basmath,"Mahatma Gandhi Vidyalaya Pri.School, Purna Project, Basmath Room No. 1",92
272 - Basmath,"Mahatma Gandhi Vidyalaya Pri.School, Purna Project, Basmath Room No. 2",92
273 - Basmath,"Branch Officer, Purana Shibodhare Branch, B.B.C. Office, Basamat (Office)",92
274 - Basmath,"Shidheshwar vidyalaya, new building, Basmath, Room no.1",92
275 - Basmath,"Shidheshwar vidyalaya, new building, Basmath, Room no.2",92
276 - Basmath,"Shidheshwar vidyalaya, new building, Basmath, Room no.3",92
277 - Ganeshpur,Z.P.P.S. Ganeshpur Room no.1,92
278 - Kanhergaon,Z.P.P.S. Kanhergaon Room no.1,92
279 - Jawla T. Babhulgaon,Z.P.P.S. Jawla T. Babhulgaon Room no.1,92
280 - Malwata,Z.P.P.S. Malwata Room no.1,92
281 - Malwata,Z.P.P.S. Malwata Room no.2,92
282 - Murumba,Z.P.P.S. Murumba Room no.1,92
283 - Palasgaon T. Malwata,Z.P.C.P.S. Palasgaon T. Malwata Room no.1,92
284 - Palasgaon T. Malwata,Z.P.C.P.S. Palasgaon T. Malwata Room no.2,92
285 - Injangaon (West),Z.P.P.S.Injangaon (West) Room no.1,92
286 - Injangaon (East),Z.P.P.S. Injangaon (East) Room no.1,92
287 - Thorawa,Z.P.P.S. Thorawa Room no.1,92
288 - Thorawa,Z.P.P.S. Thorawa Room no.2,92
289 - Kagban,Z.P.P.S. Kagban Room no.1,92
290 - Satephal T. Aral,Z.P.P.S. Satephal T. Aral Room no.1,92
291 - Satephal T. Aral,Z.P.P.S. Satephal T. Aral Room no.2,92
292 - Ekrukha,Z.P.P.S. Ekrukha Room no.1,92
293 - Pimpalgaon Kute,Z.P.P.S. Pimpalgaon Kute Room no.1,92
294 - Kaudgaon,Z.P.P.S. Kaudgaon Room no.1,92
295 - Konatha,Z.P.P.S. Konatha Room no.1,92
296 - Ridhora,Z.P.P.S. Ridhora Room no.1,92
297 - Dhanora T. Aral,Z.P.P.S. Dhanora T. Aral Room no.1,92
298 - Bhogaon,Z.P.P.S. Bhogaon Room no.1,92
299 - Palshi,Z.P.P.S. School Palshi Room No.1,92
300 - Lingi,Z.P.P.S. Lingi Room no.1,92
301 - Raiwadi,Z.P.P.S. Raiwadi Room no.1,92
302 - Takalgaon,Z.P.P.S. Takalgaon Room no.1,92
303 - Bhoripgaon,Z.P.P.S. Bhoripgaon Room no.1,92
304 - Gunj T. Asegaon,Z.P.P.S. Gunj T. Asegaon Room no.1,92
305 - Gunj T. Asegaon,Z.P.P.S. Gunj T. Asegaon Room no.2,92
306 - Runj T. Asegaon,Z.P.P.S. Runj T. Asegaon Room no.1,92
307 - Asegaon,Z.P.P.S. Asegaon Room no.1,92
308 - Asegaon,Z.P.P.S. Asegaon Room no.2,92
309 - Marlapur,Z.P.P.S. Marlapur Room no.1,92
310 - Rajapur,Z.P.P.S. Rajapur Room no.1,92
311 - Babhulgaon,"Z.P.P.S. Babhulgaon, South wing Room no.1",92
312 - Babhulgaon,"Z.P.P.S. Babhulgaon, South wing Room no.2",92
313 - Purna Sahkari Sakhar Karkhana,Z.P.C.P.S.Purna Sahkari Sakhar Karkhana Room no.1,92
314 - Pimpla Chaure,Z.P.P.S.Pimpla Chaure Room no.1,92
315 - Mudi,Z.P.P.S.Mudi Room no.1,92
316 - Sarola,Z.P.P.S. Sarola Room no.1,92
317 - Hayatnagar,Z.P.High School. Hayatnagar East wing Room no.1,92
318 - Hayatnagar,Z.P.High School. Hayatnagar West wing Room no.1,92
319 - Hayatnagar,Z.P.High School. Hayatnagar West wing Room no.2,92
320 - Jawala Bu.,Z.P.P.S. Jawala Bu. Room no.1,92
321 - Loan Bu.,Z.P.P.S. Loan Bu. East Wing Room no.1,92
322 - Renkapur,Z.P.P.S. Renkapur Room no.1,92
323 - Wakhari,"Z.P.P.S. Wakhari East wing, Room no.1",92
324 - Wakhari,"Z.P.P.S. Wakhari West wing, Room no.1",92
325 - Lahan,"Z.P.P.S. Lahan, Room no.1",92
326 - Hivra Khu.,"Z.P.P.S. Hivra Khu., Room no.1",92
327 - Sunegaon,"Z.P.P.S. Sunegaon, Room no.1",92
